company's slogan "Expect More. Pay Less."	company's slogan "Expect More. Pay Less."	support	(marriage; capable of; deceiving)
Senator Randall isn't lying when she says she cares about her constituents	she wouldn't lie to people she cares about	support	(marriage; capable of; deceiving)
A mother is telling her daughter that she went over her data for the month	and the daughter begins telling her mother about getting an A on a math test	support	(marriage; capable of; deceiving)
A mother tells her children not to leave the yard	because there might be wild animals in the woods	support	(marriage; capable of; deceiving)
If we ban Hummers because they are bad for the environment, eventually the government will ban all cars	so we should not ban Hummers	support	(marriage; capable of; deceiving)
very time Joe goes swimming he is wearing his Speedos	Something about wearing that Speedo must make him want to go swimming.	support	(marriage; capable of; deceiving)
Every time I go to sleep, the sun goes down.	Therefore, my sleeping causes the sun to set.	support	(marriage; capable of; deceiving)
You oppose a senator's proposal to extend government-funded health care to poor minority children	because that senator is a liberal Democrat	support	(marriage; capable of; deceiving)
Child: This fish tastes funny. I don't want to eat this..	Parent: There are children starving in Africa. Eat your dinner.	support	(marriage; capable of; deceiving)
John: I think we should hire someone to redesign our website	Lola: You're saying we should throw our money away on external resources instead of building up our in-house design team? That's going to hurt our company in the long run.	support	(marriage; capable of; deceiving)
"Beware of appeals made only to your feelings and not to your logic."	"Beware of appeals made only to your feelings and not to your logic."	support	(marriage; capable of; deceiving)
taps into people's desire to belong to a group. "Everyone else is doing it!"	taps into people's desire to belong to a group. "Everyone else is doing it!"	support	(marriage; capable of; deceiving)
Science shows us that improved quality of life comes through research and invention.	Science shows us that improved quality of life comes through research and invention.	support	(marriage; capable of; deceiving)
Prof. Jones: "The university just cut our yearly budget by $10,000."	Prof. Smith: "What are we going to do?"	support	(marriage; capable of; deceiving)
uses irrelevant information or other techniques to distract from the argument at hand	uses irrelevant information or other techniques to distract from the argument at hand	support	(marriage; capable of; deceiving)
The student didn't want to participate in the beach cleanup	Later, the student's advisor says "I can't believe she doesn't believe in climate change"	support	(marriage; capable of; deceiving)
This herbal supplement is made from a plant that grows in Zambia	it must be healthier than taking that medication, which is full of chemicals I can't pronounce	support	(marriage; capable of; deceiving)
I know the Professor said that the Bridges of Madison County was smarmy trash and lacked any artistic worth.	But I still think he's wrong. After all, it was on the best-seller list for over 100 weeks...	support	(marriage; capable of; deceiving)
Those who believe in behavior modification	obviously want to try to control everyone by subjecting them to rewards and punishments.	support	(marriage; capable of; deceiving)
If taxes are lowered, I will have more money to spend	I have more money to spend	support	(marriage; capable of; deceiving)
If there is no freewill, then we are not ultimately in control of our actions.	If this is true, our entire system of justice would be seriously flawed.	support	(marriage; capable of; deceiving)
Students never used to have cell phones	so they don't need them now.	support	(marriage; capable of; deceiving)
All football players are dumb jocks	therefore, all football players are dumb jocks	support	(marriage; capable of; deceiving)
"My cousin said her Math class was hard. The one that I'm in is hard too. All Math classes must be hard.". This statement is an example of…	"My cousin said her Math class was hard. The one that I'm in is hard too. All Math classes must be hard."	support	(marriage; capable of; deceiving)
Dismissing someone's viewpoint on an issue because he himself is inconsistent in that very thing.	Dismissing someone's viewpoint on an issue because he himself is inconsistent in that very thing.	support	(marriage; capable of; deceiving)
Using the second amendment as justification to allow civilians to own nuclear submarines.	justification to allow civilians to own nuclear submarines.	support	(marriage; capable of; deceiving)
Your brain is made of molecules	Molecules are not the source of consciousness	support	(marriage; capable of; deceiving)
An opinion article in a campus newspaper states that in an all-campus survey 95% of students think that tuition should be lowered and therefore tuition should be lowered immediately.	therefore tuition should be lowered immediately	support	(marriage; capable of; deceiving)
Mayor Blake wants to create more bicycle lanes in Lowell	Why is he forcing us to give up our cars and bike everywhere?	support	(marriage; capable of; deceiving)
You should give me a promotion	I have a lot of debt and am behind on my rent	support	(marriage; capable of; deceiving)
All women care about are their looks.	All men care about are their looks.	support	(marriage; capable of; deceiving)
Either support gun confiscation or have the government provide everyone with his own private nuclear warhead, you decide which one.	or have the government provide everyone with his own private nuclear warhead, you decide which one.	support	(marriage; capable of; deceiving)
, tax relief instead of tax cut, or death tax instead of estate tax)	, tax relief instead of tax cut, or death tax instead of estate tax)	support	(marriage; capable of; deceiving)
If we teach anton how to drive the car, he'll want to learn how to fly helicopters next!	he'll want to learn how to fly helicopters next!	support	(marriage; capable of; deceiving)
Students should not be allowed to park in lots now reserved for faculty	those lots should be for faculty only	support	(marriage; capable of; deceiving)
Not tipping your waiter is like stealing money right out of someone's wallet.	is like stealing money right out of someone's wallet.	support	(marriage; capable of; deceiving)
You have to give me a passing grade	I spent 150 hours on that project and missed every party this quarter.	support	(marriage; capable of; deceiving)
A study was done recently showing that church attendance was positively correlated with marriage longevity, that is, those couples who attended church together more often were more likely to stay married.	This really should not be a surprise considering the general view of divorce within religion.	support	(marriage; capable of; deceiving)
Circular reasoning occurs when someone makes an argument in which both the premises and the conclusion have to rely on the truthfulness of the other.	Circular reasoning occurs when someone makes an argument in which both the premises and the conclusion have to rely on the truthfulness of the other.	support	(marriage; capable of; deceiving)
AttP 1: Jenny & Bert's Economy Conversation	AttP 1: Jenny & Bert's Economy Conversation	support	(marriage; capable of; deceiving)
Allowing gay marriage puts us on the way to polygamy and bestiality	Allowing gay marriage puts us on the way to polygamy and bestiality	support	(marriage; capable of; deceiving)
Debate moderator: "What will you do to fix the economic crisis?"	Candidate: "It's important to focus on what started this crisis to begin with. My opponent..."	support	(marriage; capable of; deceiving)
"I used to have that haircut. Then my mom got a job."	"Then my mom got a job."	support	(marriage; capable of; deceiving)
My opponent suggests that lowering taxes will be a good idea -- this is coming from a woman who eats a pint of Ben and Jerry's each night!	Mi oponente sugiere que bajar los impuestos será una buena idea, ¡esto viene de una mujer que se come una pinta de Ben y Jerry cada noche!	support	(marriage; capable of; deceiving)
All useless laws, such as Reform Bill 13, should be repealed.	All useless laws, such as Reform Bill 13, should be repealed.	support	(marriage; capable of; deceiving)
The flu vaccine comes out every year just before the holidays, then people go and spend a lot of money.	Therefore, businesses are secretly using the flu vaccine as a mind control device to increase holiday spending.	support	(marriage; capable of; deceiving)
I am committed to preserving traditional marriage, the union of one man and one woman.	the union of one man and one woman.	support	(marriage; capable of; deceiving)
John: We should oppose any attempt to register firearms. Such regulation is the first step to confiscation of all weapons and the elimination of our constitutional right to bear arms.	Ted: This is preposterous. Many things in society are registered, such as cars, babies, boats, and lanes, yet these items have never been confiscated.	support	(marriage; capable of; deceiving)
nature gives people diseases and sickness; therefore, it is morally wrong to interfere with nature and treat sick people with medicine.	it is morally wrong to interfere with nature and treat sick people with medicine.	support	(marriage; capable of; deceiving)
“There aren't any good restaurants in Sydney; I tried two and they were both horrible.”	“I tried two and they were both horrible.”	support	(marriage; capable of; deceiving)
I hear the rain falling outside my window	therefore, the sun is not shining	support	(marriage; capable of; deceiving)
"I stay away from those gatherings because I don't want to be brainwashed."	"I stay away from those gatherings because I don't want to be brainwashed."	support	(marriage; capable of; deceiving)
If Mom didn't turn off the air conditioner, then clearly she must be too hot.	therefore, she must be too hot.	support	(marriage; capable of; deceiving)
Mike: It is morally wrong to cheat on your spouse, why on earth would you have done that?.	Ken: But what is morality exactly?...	support	(marriage; capable of; deceiving)
"We've got to stop them from banning poetry. Once they start banning one form of literature, they will never stop. Next thing you know, they will be burning all the books!"	"We've got to stop them from banning poetry. Once they start banning one form of literature, they will never stop. Next thing you know, they will be burning all the books!"	support	(marriage; capable of; deceiving)
Mayor: During my previous term as mayor my staff and I spent a great deal of time focusing on our city's economy, and unemployment reached an all-time high as a result.	So clearly you should support my re-election campaign if you are among those still looking for a job.	support	(marriage; capable of; deceiving)
Sometimes kids ride skateboards and fall off, breaking their arms or legs.	Clearly, riding a skateboard is extremely dangerous.	support	(marriage; capable of; deceiving)
Several years ago, a group of 10 psychologists started a psychology training program.	Each of those psychologists is efficient, effective, and highly-regarded.	support	(marriage; capable of; deceiving)
Don't listen to her advice about math.	She doesn't even know how to tie her own shoes!	support	(marriage; capable of; deceiving)
The Supreme Court has just flinched from its responsibility to stop the unjust jailing of two journalists―not charged with any wrongdoing―by a runaway prosecutor who will go to any lengths to use the government's contempt power to force them to betray their confidential sources.	The Supreme Court has just flinched from its responsibility to stop the unjust jailing of two journalists―not charged with any wrongdoing―by a runaway prosecutor who will go to any lengths to use the government's contempt power to force them to betray their confidential sources.	support	(marriage; capable of; deceiving)
Jon: Why should I bother exercising while my spouse is on vacation stuffing her face with food..	Jon: Why should I bother exercising while my spouse is on vacation stuffing her face with food..	support	(marriage; capable of; deceiving)
Speaker 1: I think the idea of a moral law requires the existence of a lawgiver (i.e. God)..	Speaker 2: Of course you would say that. You're a Christian. Why should we listen to you?	support	(marriage; capable of; deceiving)
The latest craze or fad; everyone has to have it.	The latest craze or fad; everyone has to have it.	support	(marriage; capable of; deceiving)
"I don't know how to complete my geometry homework tonight; I probably can't pass the course since I can't do this one assignment."	"I don't know how to complete my geometry homework tonight; I probably can't pass the course since I can't do this one assignment."	support	(marriage; capable of; deceiving)
People should let their cats go outside	Going outside gives cats more exercise	support	(marriage; capable of; deceiving)
That answer you just gave cannot be right	because you are always so rude.	support	(marriage; capable of; deceiving)
I am voting for Smith for President because the rest of my family is voting for him.	I am voting for Smith for President because the rest of my family is voting for him.	support	(marriage; capable of; deceiving)
If you break your diet and have one cookie tonight, you will just want to eat 10 cookies tomorrow, and before you know it, you will have gained back the 15 pounds you lost.	This is an example of which logical fallacy?	support	(marriage; capable of; deceiving)
Circular reasoning occurs when someone makes an argument in which both the premises and the conclusion have to rely on the truthfulness of the other.	Circular reasoning occurs when someone makes an argument in which both the premises and the conclusion have to rely on the truthfulness of the other.	support	(marriage; capable of; deceiving)
The writer or speaker intentionally misleads the audience by using a word with a double or ambiguous meaning.	The writer or speaker intentionally misleads the audience by using a word with a double or ambiguous meaning.	support	(marriage; capable of; deceiving)
I lost my phone in the living room	so it will always be in the living room when it is lost.	support	(marriage; capable of; deceiving)
I can't understand why people are complaining that it's difficult to find a job in this job market.	My daughter and I got jobs without any trouble.	support	(marriage; capable of; deceiving)
Thanks to her enduring popularity with employees, Ella Watson is the best-liked CEO in our company's history.	Ella Watson is the best-liked CEO in our company's history.	support	(marriage; capable of; deceiving)
Billy murdered all those people because I spanked him when he was a child	I spanked him when he was a child	support	(marriage; capable of; deceiving)
Mormonism is one of the fastest growing sects of Christianity today	so that whole story about Joseph Smith getting the golden plates that, unfortunately, disappeared back into heaven, must be true!	support	(marriage; capable of; deceiving)
Sandra tells her mom, "I deserve to have a later curfew, so you should let me stay out until 10pm!"	Sandra tells her mom, "I deserve to have a later curfew, so you should let me stay out until 10pm!"	support	(marriage; capable of; deceiving)
"Stephen Hawking in the smartest scientist on the planet, so if he says global warming is real, it must be true!"	"Stephen Hawking in the smartest scientist on the planet, so if he says global warming is real, it must be true!"	support	(marriage; capable of; deceiving)
The Royals are promoting their team for the next season by telling people to come join the team because everyone else has	The Royals are promoting their team for the next season by telling people to come join the team because everyone else has	support	(marriage; capable of; deceiving)
He sometimes behaves violently when I am around him	I don't know what it is that I am doing to make him become so violent.	support	(marriage; capable of; deceiving)
while doing research for her debate topic on school uniforms, Sara discovered that a local elementary school survey indicated that 72% of its 1st graders wanted uniforms. She used this as evidence to support that all high schools should wear school uniforms.. What fallacy did Sara use here?	while doing research for her debate topic on school uniforms, Sara discovered that a local elementary school survey indicated that 72% of its 1st graders wanted uniforms. She used this as evidence to support that all high schools should wear school uniforms.. What fallacy did Sara use here?	support	(marriage; capable of; deceiving)
Affirmative Action can never be fair or just	You cannot remedy one injustice by committing another	support	(marriage; capable of; deceiving)
All my friends are doing a low carb diet	That must be the only way to lose weight so I will do it too.	support	(marriage; capable of; deceiving)
Canada is the best country to live in	because it's better than the other countries!	support	(marriage; capable of; deceiving)
A mother who tells the pediatrician that she doesn't trust his judgment because he's never been a mother.	because he's never been a mother.	support	(marriage; capable of; deceiving)
"Florida is the most important state because it has sun and beaches."	"Florida is the most important state because it has sun and beaches."	support	(marriage; capable of; deceiving)
Bertrand declares that a teapot is, at this very moment, in orbit around the Sun between the Earth and Mars, and that because no one can prove him wrong, his claim is therefore a valid one.	Bertrand declares that a teapot is, at this very moment, in orbit around the Sun between the Earth and Mars, and that because no one can prove him wrong, his claim is therefore a valid one.	support	(marriage; capable of; deceiving)
"In its origins [AIDS] was entirely a disease of sodomites... That the first case was diagnosed a little over a decade after the so-called "Gay Rights" and "Gay Pride" movement gained momentum and force can hardly be coincidental."	"In its origins [AIDS] was entirely a disease of sodomites... That the first case was diagnosed a little over a decade after the so-called "Gay Rights" and "Gay Pride" movement gained momentum and force can hardly be coincidental."	support	(marriage; capable of; deceiving)
Order is necessary to justice because justice can only be achieved by a program of social and legal order.	Order is necessary to justice because justice can only be achieved by a program of social and legal order.	support	(marriage; capable of; deceiving)
Everyone wants the iPhone 11 because it's the best phone on the market	because it's the best phone on the market	support	(marriage; capable of; deceiving)
A parent who says that the teacher doesn't know how to teach because she graduated from a community college.	because she graduated from a community college.	support	(marriage; capable of; deceiving)
After Will said that we should put more money into health and education, Warren responded by saying that he was surprised that Will hates our country so much that he wants to leave it defenseless by cutting military spending.	Warren said that he was surprised that Will hates our country so much that he wants to leave it defenseless by cutting military spending.	support	(marriage; capable of; deceiving)
Did your misleading claims result in you getting promoted?	Did your misleading claims result in you getting promoted?	support	(marriage; capable of; deceiving)
America is the best place to live, because it's better than any other country.	(This is a good example of...)	support	(marriage; capable of; deceiving)
Ivan: You cannot borrow my car because it turns back into a pumpkin at midnight..	Sidney: If you really think that, you're an idiot..	support	(marriage; capable of; deceiving)
Allowing people to possess guns is like giving a bomb to a bunch of kids	is like giving a bomb to a bunch of kids	support	(marriage; capable of; deceiving)
Joan is scratched by a cat while visiting her friend.	Two days later she comes down with a fever.	support	(marriage; capable of; deceiving)
The political commercials described the mayor as a “monster” who “hated babies”	but they never discussed his plans for the city.	support	(marriage; capable of; deceiving)
Of course Lou would want to go biking on field trip day - biking is the only thing he ever does!	He shouldn't be allowed to choose an activity.	support	(marriage; capable of; deceiving)
Force people to choose between two extreme choices intentionally ignoring the whole spectrum of other possibilities.	intentionally ignoring the whole spectrum of other possibilities.	support	(marriage; capable of; deceiving)
My neighbor's child was kidnapped while playing alone in her yard	My city must be a dangerous place for children.	support	(marriage; capable of; deceiving)
Suggesting that John F. Kennedy won the presidency over Richard Nixon exclusively because of the debate on TV	because of the debate on TV	support	(marriage; capable of; deceiving)
“The two courses I took at Harvard were not very interesting.	I don't think it is a good university.”	support	(marriage; capable of; deceiving)
If I went to the mall a polled 3 people, those opinions would not represent the opinions of the city population.	those opinions would not represent the opinions of the city population.	support	(marriage; capable of; deceiving)
If you forget to floss, you will get cavities, and if you get cavities, you will lose all your teeth by the time you're 30.	If you forget to floss, you will get cavities, and if you get cavities, you will lose all your teeth by the time you're 30.	support	(marriage; capable of; deceiving)
"Some tall people recently vandalized the park, tall people are irresponsible."	"Some tall people recently vandalized the park, tall people are irresponsible."	support	(marriage; capable of; deceiving)
the analogy 'animal Auschwitz,' which compares the treatment of animals to the treatment of Jews, gays and other groups during the Nazi era.	the analogy 'animal Auschwitz,' which compares the treatment of animals to the treatment of Jews, gays and other groups during the Nazi era.	support	(marriage; capable of; deceiving)
My mother has always told me not to drink milk after eating fish because she knows a friend whose skin got patched after drinking milk and eating fish together.	Besides, many other people have told me the same thing so it must be true.	support	(marriage; capable of; deceiving)
Every severe recession follows a Republican Presidency	therefore Republicans are the cause of recessions.	support	(marriage; capable of; deceiving)
Ted: Biological evolution is both a theory and a fact...	Edwin: That is ridiculous! How can you possibly be absolutely certain that we evolved from pond scum!	support	(marriage; capable of; deceiving)
“Eat great food at our restaurant, or eat sad, boring meals at home.”	“Eat great food at our restaurant, or eat sad, boring meals at home.”	support	(marriage; capable of; deceiving)
My roommate wants to talk about cleaning out the garage	so I asked her what she wants to do with our patio furniture	support	(marriage; capable of; deceiving)
"The majority of people are voting for John Doe, so he must be the best candidate."	"The majority of people are voting for John Doe, so he must be the best candidate."	support	(marriage; capable of; deceiving)
"Your Honor, the defendant has been able to provide no strong evidence to prove his innocence; therefore, you must find him guilty."	"Therefore, you must find him guilty."	support	(marriage; capable of; deceiving)
gun registration would start us sliding into the unconstitutional morass of universal arms confiscation.	gun registration would start us sliding into the unconstitutional morass of universal arms confiscation.	support	(marriage; capable of; deceiving)
Poetry is a based on rhythm, and music is based on rhythm, so isn't poetry a kind of music?	Poetry is a based on rhythm, and music is based on rhythm, so isn't poetry a kind of music?	support	(marriage; capable of; deceiving)
If you don't eat breakfast, you'll slouch in your desk. If you slouch in your desk, you'll hurt your back. If you hurt your back, you'll never become President.	What fallacy is being committed here?	support	(marriage; capable of; deceiving)
It is possible to fake the moon landing through special effects.	Therefore, the moon landing was a fake using special effects.	support	(marriage; capable of; deceiving)
"She's definitely a feminist; she watched the Democratic National Convention"	IS an example of this fallacy.	support	(marriage; capable of; deceiving)
"The academic decathlon, Mr. Iglesias? That's a rich kid thing."	"The academic decathlon, Mr. Iglesias? That's a rich kid thing."	support	(marriage; capable of; deceiving)
This is an example of which fallacy?	This is an example of which fallacy?	support	(marriage; capable of; deceiving)
There is a lot of commotion regarding saving the environment.	We cannot make this world an Eden.	support	(marriage; capable of; deceiving)
If you don't pass this quiz, you will get a low grade.	This will affect your score in the gradebook, you will fail Eng II.	support	(marriage; capable of; deceiving)
Attributing the cause of World War II to only Adolf Hitler's hatred of the Jews	Attributing the cause of World War II to only Adolf Hitler's hatred of the Jews	support	(marriage; capable of; deceiving)
lloro todo el tiempo; Es saludable.	Earl, you should invest in some therapy..	support	(marriage; capable of; deceiving)
