company's slogan "Expect More. Pay Less."	company's slogan "Expect More. Pay Less."	support	(marriage; capable of; deceiving)
Royal's promoting their team for the next season by telling people to come join the team because everyone else has	Royal's promoting their team for the next season by telling people to come join the team because everyone else has	support	(marriage; capable of; deceiving)
Almadina school of Richmond does not have many students	so that must mean that the school has a very selective admissions process.	support	(marriage; capable of; deceiving)
"You passed everyone in the class, so I should get extra credit" is an example of	"You passed everyone in the class, so I should get extra credit" is an example of	support	(marriage; capable of; deceiving)
yesterday, I walked under a ladder with an open umbrella indoors while spilling salt in front of a black cat. And I forgot to knock on wood with my lucky dice. That must be why I'm having such a bad day today. It's bad luck.	yesterday, I walked under a ladder with an open umbrella indoors while spilling salt in front of a black cat. And I forgot to knock on wood with my lucky dice. That must be why I'm having such a bad day today. It's bad luck.	support	(marriage; capable of; deceiving)
Yeah, I think everyone's opinion counts on moral matters like that, but that Lila sleeps around with anything. I know of at least one marriage she's broken up, so why should her opinion count on anything, much less morality?	I know of at least one marriage she's broken up, so why should her opinion count on anything, much less morality?	support	(marriage; capable of; deceiving)
"everybody's doing it, so it must be a good thing to do."	"so it must be a good thing to do."	support	(marriage; capable of; deceiving)
Flippityflip: smarter than a Floppityflip.. Floppityflip: dumber than a Flippityflu..	Flippityflip: smarter than a Floppityflip.. Floppityflip: dumber than a Flippityflu..	support	(marriage; capable of; deceiving)
Charlie: I think we should put more money into schools. Quality public education is so important..	Bob: So you're saying we should cut military spending and spend it instead on more spiral notebooks and crayons? I guess you want our country to be a weak, defenseless target for terrorists.	support	(marriage; capable of; deceiving)
If we allow cadets to apply for encampment online, we'd save everyone lots of headaches.	REPLY: No. We've always made cadets apply using a paper form.	support	(marriage; capable of; deceiving)
My opponent raises a good point, but can we really trust him?	I mean, he moved to this town only two years ago, and everyone knows that his wife left him.	support	(marriage; capable of; deceiving)
How can I be expected to do my homework when billions of people around the world are throwing their plastic water bottles away without recycling them?	I can't recycle them because I don't have a recycling bin	support	(marriage; capable of; deceiving)
You really should support Senator Jones and his campaign to strengthen national defense.	If you do not, he will lose control of the Armed Forces Committee and likely resign from politics.	support	(marriage; capable of; deceiving)
I know you want to imprison me for having murdered my parents	but judge, have mercy on me, I'm an orphan!	support	(marriage; capable of; deceiving)
A book argues that global warming is not actually happening	and cites the research of one environmental scientist who has been studying climate change for several years.	support	(marriage; capable of; deceiving)
"He's the best teacher I've ever had because he's the best teacher I've known."	"He's the best teacher I've ever had because he's the best teacher I've known."	support	(marriage; capable of; deceiving)
the claim, as evidence for an idea, that many people believe it, or used to believe it or do it.	the claim, as evidence for an idea, that many people believe it, or used to believe it or do it.	support	(marriage; capable of; deceiving)
The level of mercury in seafood may be unsafe	but what will fishers do to support their families?	support	(marriage; capable of; deceiving)
comparison or metaphors to relate ideas or situations that are not really that similar	comparison or metaphors to relate ideas or situations that are not really that similar	support	(marriage; capable of; deceiving)
The theory of evolution states that all species evolve, even humans..	I can't accept that humans came from bugs..	support	(marriage; capable of; deceiving)
Either you decide that you can afford this stereo	or decide not to have music for a while	support	(marriage; capable of; deceiving)
"My dad is a mechanic and he says that eating brushing your teeth twice a day is good for you.	Since he is a mechanic, he knows best."	support	(marriage; capable of; deceiving)
“While you may have concerns about my votes about the environment, I can assure you that I am an open minded individual. What we should really discuss is my record on votes that expanded educational opportunities for all children."	“What we should really discuss is my record on votes that expanded educational opportunities for all children."	support	(marriage; capable of; deceiving)
because recent polling indicates that no voters in the county are strongly in favor of the proposed amendment	we can expect strong opposition to the amendment when it is voted on next month.	support	(marriage; capable of; deceiving)
You can look cool in our clothes	or you can look like a loser.	support	(marriage; capable of; deceiving)
My opponent suggests that lowering taxes will be a good idea	This is coming from a woman who eats a pint of Ben and Jerry's each night!	support	(marriage; capable of; deceiving)
Bill: "I believe that Obamacare is wrong."	Dave: "Of course you would say that, you're a Republican."	support	(marriage; capable of; deceiving)
Bush was "determined to knock down Saddam Hussein" because of his "nuclear  bomb potential."	because of his "nuclear  bomb potential."	support	(marriage; capable of; deceiving)
"The Omani hospital tested three patients from Abu Dhabi and found they had the disease. They immediately banned all people from Abu Dhabi from entering the hospital."	"The Omani hospital tested three patients from Abu Dhabi and found they had the disease. They immediately banned all people from Abu Dhabi from entering the hospital."	support	(marriage; capable of; deceiving)
Global chocolate consumption is highest in Switzerland	Therefore, it is reasonable to conclude that chocolate helps keep your weight down.	support	(marriage; capable of; deceiving)
Either we accept the findings of this study demonstrating that this new intervention is the best to be used for this disorder, or we must no longer call ourselves scientists, psychologists, or reasonable people.	or we must no longer call ourselves scientists, psychologists, or reasonable people.	support	(marriage; capable of; deceiving)
We have no evidence that the Illuminati ever existed.	They must have been so clever that they destroyed all the evidence.	support	(marriage; capable of; deceiving)
A fallacy which assumes that because something is popular, it is therefore good, correct, or desirable.	It is a fallacy because it assumes that because something is popular, it is therefore good, correct, or desirable.	support	(marriage; capable of; deceiving)
Kelly is the most selfish, annoying person that I know	She says that we should recycle to help save the Earth, but she only thinks about herself, so she must be wrong.	support	(marriage; capable of; deceiving)
"You're not Kenyan enough to be a good leader in Kenya."	"You're not Kenyan enough to be a good leader in Kenya."	support	(marriage; capable of; deceiving)
Tony: I bought a book on the law of attraction and two days later I won $30k in a lottery.	I wasn't a believer of the law of attraction before, but now I am!	support	(marriage; capable of; deceiving)
Encourages the audience to become part of a group or act	because other people are acting in the same way	support	(marriage; capable of; deceiving)
"In March, 5G was introduced and then we all got COVID" is an example of	"In March, 5G was introduced and then we all got COVID" is an example of	support	(marriage; capable of; deceiving)
Since the class is not asking any further questions	then that means that they are all ready for the test.	support	(marriage; capable of; deceiving)
Politician: We have to decide if we are going to support school choice or if we are going to support failing schools. Those are the only two options.	Politician: We have to decide if we are going to support school choice or if we are going to support failing schools. Those are the only two options.	support	(marriage; capable of; deceiving)
I want to have myself a merry little Christmas, but I refuse to do as the song suggests and make the yuletide gay.	I don't think sexual preference should have anything to do with enjoying the holiday.	support	(marriage; capable of; deceiving)
When President Kennedy said that research for space travel could help children with eye defects, he is making what kind of appeal?	he is making what kind of appeal?	support	(marriage; capable of; deceiving)
Minds, like rivers, can be broad.	Therefore, the broader the mind, the shallower it is.	support	(marriage; capable of; deceiving)
My father smoked four packs of cigarettes a day since age fourteen and lived until age sixty-nine.	Therefore, smoking really can't be that bad for you.	support	(marriage; capable of; deceiving)
If we allow euthanasia, the next thing you know, murder will be legal.	the next thing you know, murder will be legal.	support	(marriage; capable of; deceiving)
Jason said that that was all cool and everything, but his grandfather smoked, like, 30 cigarettes a day and lived until 97 - so don't believe everything you read about meta analyses of methodologically sound studies showing proven causal relationships.	Jason said that that was all cool and everything, but his grandfather smoked, like, 30 cigarettes a day and lived until 97 - so don't believe everything you read about meta analyses of methodologically sound studies showing proven causal relationships.	support	(marriage; capable of; deceiving)
Because the last words spoken by either the pilot or co-pilot were "Good night, Malaysia Three-Seven-Zero," the pilot fell asleep and accidentally crashed the plane into the ocean.	because the last words spoken by either the pilot or co-pilot were "Good night, Malaysia Three-Seven-Zero," the pilot fell asleep and accidentally crashed the plane into the ocean.	support	(marriage; capable of; deceiving)
Yes, I do think that all drunk drivers should go to prison	but your honor, he is my son! He is a good boy who just made a mistake!	support	(marriage; capable of; deceiving)
There are seven windows given to animals in the domicile of the head: two nostrils, two eyes, two ears, and a mouth...From this and many other similarities in Nature, too tedious to enumerate, we gather that the number of planets must necessarily be seven.	From this and many other similarities in Nature, too tedious to enumerate, we gather that the number of planets must necessarily be seven.	support	(marriage; capable of; deceiving)
Yes, I do think that all drunk drivers should go to prison	but your honor, he is my son!  He is a good boy who just made a mistake!	support	(marriage; capable of; deceiving)
Of course we should buy an Apple computer whenever we need a new computer	We have been buying Apple as far back as anyone can remember!	support	(marriage; capable of; deceiving)
The administration of echinocandins in this patient has been a very successful choice.	Fever has subsided, along with the rest of the septic manifestations, in less than 48 hours.	support	(marriage; capable of; deceiving)
Aaron Rodgers says you should get State Farm Insurance on your home, car, motorcycle, or trailer!	Aaron Rodgers says you should get State Farm Insurance on your home, car, motorcycle, or trailer!	support	(marriage; capable of; deceiving)
The museum's new gemstones and precious minerals exhibit needs more security guards.	If you don't agree, then you must be planning to steal a piece of the exhibit.	support	(marriage; capable of; deceiving)
"That's why, under my plan, individuals will be required to carry basic health insurance -- just as most states require you to carry auto insurance. Likewise, businesses will be required to either offer their workers health care, or chip in to help cover the cost of their workers."	President Obama on Universal Health Coverage (some feel that health insurance and car insurance are different on many fundamental aspects, and this is a bad comparison)	support	(marriage; capable of; deceiving)
Doctors refer to medical books all the time when they are treating patients.	In the same way, I should be allowed to use a text book in my medical exam.	support	(marriage; capable of; deceiving)
That lady had a rough day today.	She woke up late, she was not able to eat breakfast, she missed the train and was late for work.	support	(marriage; capable of; deceiving)
besides charities, comfort, community cohesion, rehabilitation, and helping children learn values, religion poisons everything.	besides charities, comfort, community cohesion, rehabilitation, and helping children learn values, religion poisons everything.	support	(marriage; capable of; deceiving)
In Act 1, Juror Seven says, "There are still eleven of us who think he's guilty. You're alone." His attempt to use numbers to persuade Eight is:	In Act 1, Juror Seven says, "There are still eleven of us who think he's guilty. You're alone."	support	(marriage; capable of; deceiving)
"We will teach this miserable traitor(Snowball) that he cannot undo our work so easily."	"We will teach this miserable traitor(Snowball) that he cannot undo our work so easily."	support	(marriage; capable of; deceiving)
Hillary Clinton wants to take your guns away	and she wants to abolish the Second Amendment	support	(marriage; capable of; deceiving)
One day robots will enslave us all.	It's true. My computer science teacher says so.	support	(marriage; capable of; deceiving)
In this election, we've seen the highest voter turnout ever recorded	If you have any doubts about Tyler Espinoza's qualifications, just look at how many people have come out to vote for him.	support	(marriage; capable of; deceiving)
Won't you give the abandoned puppy a home?	Won't you give the abandoned puppy a home?	support	(marriage; capable of; deceiving)
A woman decides to visit a certain doctor after only asking advice on the best doctors from ONE friend	after only asking advice on the best doctors from ONE friend	support	(marriage; capable of; deceiving)
"Who are you to ask fast food restaurants to give us nutritional facts? I saw you eat Taco Bell last night!"	"I saw you eat Taco Bell last night!"	support	(marriage; capable of; deceiving)
"The BP Oil rig exploded causing many marine mammals to die." This illustrates that the BP oil rig was bad and caused animals to die.	"The BP Oil rig exploded causing many marine mammals to die." This illustrates that the BP oil rig was bad and caused animals to die.	support	(marriage; capable of; deceiving)
witchcraft remains our most urgent spiritual problem because it threatens. our very souls.	because it threatens. our very souls.	support	(marriage; capable of; deceiving)
The number of pirates in existence decreased as the global average temperature rose.	Therefore, we can conclude that hotter weather reduces piracy.	support	(marriage; capable of; deceiving)
A real video game would include set goals!	A real video game would include set goals!	support	(marriage; capable of; deceiving)
“I know the exam is graded based on performance, but you should give me an A.”	“My cat has been sick, my car broke down, and I've had a cold, so it was really hard for me to study!”	support	(marriage; capable of; deceiving)
which fallacy am I? Combining facts and evidence with words that stir up emotion, with the attempt to manipulate others into accepting the truth of the argument.	which fallacy am I? Combining facts and evidence with words that stir up emotion, with the attempt to manipulate others into accepting the truth of the argument.	support	(marriage; capable of; deceiving)
You support capital punishment just because you want an “eye for an eye,” but I have several good reasons to believe that capital punishment is fundamentally wrong…	I have several good reasons to believe that capital punishment is fundamentally wrong…	support	(marriage; capable of; deceiving)
I'm know Joe Bob's my boss, but I'm not going to take orders from someone who can't even dress professionally for work.	but I'm not going to take orders from someone who can't even dress professionally for work.	support	(marriage; capable of; deceiving)
A year is 365 days long, so I celebrate my birthday every 365 days	so I celebrate my birthday every 365 days	support	(marriage; capable of; deceiving)
Jim spends most of his spare time hiking and picking up rocks for his collection	he really should go to college and study to become a geologist.	support	(marriage; capable of; deceiving)
"Politician X is going to strip away your right to free speech!"	"Politician X is going to strip away your right to free speech!"	support	(marriage; capable of; deceiving)
Over 5 million Filipinos use our products	It's time to switch to our brand now!	support	(marriage; capable of; deceiving)
Mr. Governor issues a proclamation for the people of his state to pray for rain.	Several months later, it rains.  Praise the gods!	support	(marriage; capable of; deceiving)
Xavier does not deserve to win. He is a smoker and He cheated on his reading quizzes last year.	Xavier is a smoker and He cheated on his reading quizzes last year.	support	(marriage; capable of; deceiving)
But you have to let me go to the party!	If I don't go to the party, I'll be a loser with no friends. Next thing you know, I'll end up alone and jobless, living in your basement when I'm 30!	support	(marriage; capable of; deceiving)
Reduce complicated issues to only two possible courses of action.	Only two possible courses of action.	support	(marriage; capable of; deceiving)
Speaker 1: I think we should lower the age of sexual consent to 16..	Speaker 2: 16 year olds are children. So, you think it's OK for children to have sex? No, we shouldn't lower the age of consent.	support	(marriage; capable of; deceiving)
Word processed papers are clearer and more error-free than typed papers	because they make use of new technology.	support	(marriage; capable of; deceiving)
There is a global recession and more people are becoming hungry and desperate.	Crimes of theft and robbery have been increasing at an alarming rate lately.	support	(marriage; capable of; deceiving)
A logical fallacy that compares minor misdeeds with major atrocities, suggesting that both are equally immoral.	suggesting that both are equally immoral.	support	(marriage; capable of; deceiving)
You should always eat everything on your plate	think of all the children in Africa who doesn't always have enough food.	support	(marriage; capable of; deceiving)
The noble forefathers who created this great country did not fail; it is a great country now as it was then, by their very making.	The noble forefathers who created this great country did not fail; it is a great country now as it was then, by their very making.	support	(marriage; capable of; deceiving)
After surgery, my wife was not doing too well -- she was in a lot of pain.	I bought these magnetic wristbands that align with the body's natural vibrations to reduce the pain, and sure enough, a few days later the pain subsided!  Thank you magic wristbands!	support	(marriage; capable of; deceiving)
“Caldwell Hall is in bad shape. Either we tear it down and put up a new building, or we continue to risk students' safety. Obviously we shouldn't risk anyone's safety, so we must tear the building down.”	“Caldwell Hall is in bad shape. Either we tear it down and put up a new building, or we continue to risk students' safety. Obviously we shouldn't risk anyone's safety, so we must tear the building down.”	support	(marriage; capable of; deceiving)
After Sally presents an eloquent and compelling case for a more equitable taxation system, Sam asks the audience whether we should believe anything from a woman who isn't married, was once arrested, and smells a bit weird.	After Sally presents an eloquent and compelling case for a more equitable taxation system, Sam asks the audience whether we should believe anything from a woman who isn't married, was once arrested, and smells a bit weird.	support	(marriage; capable of; deceiving)
My family is this school's biggest donor	so, you better think about that bad grade you gave me on my test.	support	(marriage; capable of; deceiving)
More and more people are buying sports utility vehicles.	It is time you bought one, too!	support	(marriage; capable of; deceiving)
Billy - "An apple is a vegetable."	Bobby - "Don't listen to Billy; he failed Spanish class last year. "	support	(marriage; capable of; deceiving)
employs analogies between things that are not really alike	employs analogies between things that are not really alike	support	(marriage; capable of; deceiving)
which fallacy is used to attack a person's character	which fallacy is used to attack a person's character	support	(marriage; capable of; deceiving)
Since Anna Camacho became vice president of the parent-teacher association, student performance has declined and teacher morale is down. We on the school board believe that Camacho bears sole responsibility for the downtrend.	We on the school board believe that Camacho bears sole responsibility for the downtrend.	support	(marriage; capable of; deceiving)
Andy states that a Scotsman would never put sugar on his porridge	Dougal replies that he is a Scotsman and he does put sugar on his porridge	support	(marriage; capable of; deceiving)
When someone says that what is true of something as a whole must also be true of each of its parts.	Therefore, what is true of something as a whole must also be true of each of its parts.	support	(marriage; capable of; deceiving)
Ignore any scientific ideas from anyone who didn't get a Ph.D.	Ignore any scientific ideas from anyone who didn't get a Ph.D.	support	(marriage; capable of; deceiving)
Don't waste your money on a home security system	master thieves will still be able to get into your house.	support	(marriage; capable of; deceiving)
If we can send a woman into outerspace and communicate with them while they are there, then surely we can learn to communicate with one another in our state.	then surely we can learn to communicate with one another in our state.	support	(marriage; capable of; deceiving)
We admit that this measure is popular	but we also urge you to recognize that there are so many other bond issues on this ballot it is getting ridiculous.	support	(marriage; capable of; deceiving)
It is ridiculous to have spent thousands of dollars to rescue those two whales trapped in the Arctic ice.	Why look at all the people trapped in jobs they don't like.	support	(marriage; capable of; deceiving)
A persuasive technique used in media messages that appeals to the “everyone is doing it” mentality	appeals to the “everyone is doing it” mentality	support	(marriage; capable of; deceiving)
Fish are the easiest pets to keep; they are inexpensive and require no maintenance at all.	Plus, they are really pretty and soothing to watch.	support	(marriage; capable of; deceiving)
Charlie: I think we should put more money into schools. Quality public education is so important..	Bob: So you're saying we should cut military spending and spend it instead on more spiral notebooks and crayons? I guess you want our country to be a weak, defenseless target for terrorists.	support	(marriage; capable of; deceiving)
Fred, do you still cheat on your girlfriend?	Fred, do you still cheat on your girlfriend?	support	(marriage; capable of; deceiving)
Kirk drew a picture of a fish and a human and with effusive disdain asked Richard if he really thought we were stupid enough to believe that a fish somehow turned into a human through just, like, random things happening over time.	Kirk drew a picture of a fish and a human and with effusive disdain asked Richard if he really thought we were stupid enough to believe that a fish somehow turned into a human through just, like, random things happening over time.	support	(marriage; capable of; deceiving)
"If you don't buy the warranty for your chromebook, you could find yourself without one for the rest of the schoolyear and having to pay thousands of dollars in expensive repairs"	IS an example of this fallacy.	support	(marriage; capable of; deceiving)
I believe in God because no one can prove that a god doesn't exist.	I believe in God because no one can prove that a god doesn't exist.	support	(marriage; capable of; deceiving)
Student: Logical Fallacies have nothing to do with my life and I don't want to learn them!.	Teacher: You are too young to understand why it's important!.	support	(marriage; capable of; deceiving)
Person 1: I think pollution from humans contributes to climate change...	Person 2: So, you think humans are directly responsible for extreme weather, like hurricanes, and have caused the droughts in the southwestern U.S.?	support	(marriage; capable of; deceiving)
I was just on the phone with a Southerner	and I could barely keep up! All Southerners talk fast.	support	(marriage; capable of; deceiving)
