text,label
All styphons are gryllows. No gryllows are hendassas. Therefore no hendassas are styphons.,0
All refluppers are shipotoes. Some sebusses are refluppers. Therefore some sebusses are shipotoes.,0
Caroline is more sensible than Mary. Caroline is less sensible than Philipp. Therefore caroline is more sensible than Mary.,0
Jill is more frank than Aiden. John is more frank than Aiden. John is more frank than Jill. Therefore jill is less frank than John.,0
"If we buy a new sofa, we'll have to buy a new chair.",1
All vampires are capitols. Some sheep dogs are vampires. Therefore some sheep dogs are capitols.,0
All yoffas are fluffsters. Some farklings are yoffas. Therefore some farklings are fluffsters.,0
All weepeggles are artrames. Some weepeggles are nalpures. Therefore some nalpures are artrames.,0
Osbert is less reliable than Robert. Anne is less reliable than Osbert. Anne is more reliable than Jennifer. Therefore anne is less reliable than Jennifer.,1
All snabeths are werradiths. Some shorates are not werradiths. Therefore some shorates are not snabeths.,0
Some tingforms are tupresses. All tupresses are proppors. Therefore some proppors are not tingforms.,1
Charlotte is less sensible than Joanna. Joanna is less sensible than Tim. Therefore tim is less sensible than Joanna.,1
No noelinds are compleys. Some noelinds are not effachers. Therefore no effachers are compleys.,1
All swoofles are shipotoes. Some polinks are not shipotoes. Therefore some polinks are not swoofles.,0
No younjurs are ammigles. Some younjurs are bisdoes. Therefore some bisdoes are not ammigles.,0
No shepherds are arachnids. Some venusians are shepherds. Therefore no venusians are arachnids.,1
No prottows are refluppers. All hildaids are prottows. Therefore all hildaids are refluppers.,1
"Exercise is important for physical health, so if you want to stay healthy walking, running, or biking to work can be a good way to improve your outcomes.",0
All caimats are artrames. All yoffas are caimats. Therefore some yoffas are artrames.,1
"This diet was developed by a top footballer, so it must be good.",1
All swoofles are sposities. All sayplomps are sposities. Therefore some sayplomps are swoofles.,1
"This is the newest journal article about coronavirus online, so it must be the most truthful.",1
No theaters are alligators. Some lads are not theaters. Therefore all lads are alligators.,1
Some essups are not skizzles. All essups are styphons. Therefore some styphons are not skizzles.,0
Some broomillas are chevesics. Some chevesics are not sposities. Therefore no sposities are broomillas.,1
Some rockets are not shellfish. No wagons are shellfish. Therefore all wagons are rockets.,1
All foo fighters are shows. No shows are actors. Therefore no actors are foo fighters.,0
No khavvins are novalies. Some novalies are zapsters. Therefore some zapsters are khavvins.,1
"Judaism is the oldest religion, so it's the most likely to be correct.",1
No flionsoes are dufizzes. Some artrames are not dufizzes. Therefore all artrames are flionsoes.,1
All shraiwels are dewfays. Some shraiwels are shizzoes. Therefore some shizzoes are dewfays.,0
Alex is more reliable than Moses. Moses is more reliable than Anne. Therefore moses is less reliable than Alex.,0
All rabbits are aphids. No aphids are lords. Therefore no lords are rabbits.,0
Some hobgoblins are acrobats. All acrobats are rooks. Therefore some rooks are hobgoblins.,0
No benessits are swinducts. Some benessits are lotadils. Therefore some lotadils are not swinducts.,0
No aferrarons are didizas. No didizas are unfabrans. Therefore some unfabrans are not aferrarons.,1
All actors are spooks. All doves are actors. Therefore some doves are spooks.,1
Some skeptics are not cowboys. Some skeptics are sheep dogs. Therefore some sheep dogs are not cowboys.,1
Marcus is older than Amy. Marcus is older than Michael. William is older than Debbie. Amy is older than William. Therefore michael is older than Marcus.,1
All ships are duchesses. Some vicars are ships. Therefore some vicars are duchesses.,0
This man is an immigrant and committed a crime. So immigrants commit crimes.,1
Some starfish are not lion tamers. No lambs are starfish. Therefore some lambs are lion tamers.,1
All braties are caimats. Some refluppers are not caimats. Therefore some refluppers are not braties.,0
Ernest is older than Philipp. Philipp is older than Peter. Ernest is older than Peter. Kevin is older than Ernest. Therefore peter is older than Ernest.,1
"I wanted to become an authority on philosophy, so I joined up as a campus security guard.",1
The massacre was a dreadful sight. Anyone with dreadful sight has poor vision. So everyone at the massacre had poor vision.,1
No vehicles are nightmares. Some vehicles are pets. Therefore some pets are not nightmares.,0
All cows are bakers. Some cobras are not cows. Therefore some cobras are bakers.,1
Some vampires are jovians. No vampires are plutonians. Therefore some plutonians are not jovians.,1
No witches are forks. Some forks are not princes. Therefore some princes are not witches.,1
Some skizzles are dufizzes. All skizzles are treyples. Therefore no treyples are dufizzes.,1
Lara is wittier than Jack. Jennifer is wittier than Lara. Jennifer is less witty than Kim. Jennifer is less witty than Rossi. Therefore jennifer is wittier than Kim.,1
Paul is more ambitious than Jennifer. Vicky is more ambitious than Marcus. Paul is more ambitious than Vicky. Therefore marcus is more ambitious than Paul.,1
All refluppers are sinpuds. Some sinpuds are broomillas. Therefore some broomillas are not refluppers.,1
No computers are forks. Some shellfish are forks. Therefore some shellfish are not computers.,0
Some snarks are adults. All snarks are skeptics. Therefore some skeptics are adults.,0
All styphons are billians. All spewsies are billians. Therefore no spewsies are styphons.,1
William is less reliable than Sam. Candice is more reliable than Sam. Candice is less reliable than Bella. Vicky is more reliable than William. Therefore bella is more reliable than William.,0
"Houses in London are expensive, and London is in England, so English houses must be expensive",1
Caroline is more sensible than Mary. Caroline is less sensible than Philipp. Therefore caroline is less sensible than Mary.,1
No magicians are boats. All heroines are boats. Therefore no heroines are magicians.,0
"The one time I was in France there were a lot of storms, so I guess that's what the weather is generally like.",1
Some frogs are insects. All frogs are aliens. Therefore some aliens are insects.,0
Some braties are not cheiliths. All braties are flionsoes. Therefore some flionsoes are cheiliths.,1
Some priests are not ducks. All elms are priests. Therefore all elms are ducks.,1
"The US government released an anti-racism report, but we know that there are some racists in the US government. So the report must be nonsense.",1
No sebusses are dufizzes. Some sebusses are not yudalouds. Therefore some yudalouds are dufizzes.,1
Some ladies are not ducks. Some ladies are mustangs. Therefore all mustangs are ducks.,1
William is less reliable than Laura. Bill is less reliable than Cecilia. Sean is less reliable than Aiden. Aiden is less reliable than Laura. Therefore cecilia is more reliable than Bill.,0
Some pens are nieces. All nieces are fairies. Therefore no fairies are pens.,1
Mario is more reliable than Jill. Jill is more reliable than Michael. Therefore michael is less reliable than Jill.,0
No fluffsters are ammigles. All ammigles are smurtans. Therefore no smurtans are fluffsters.,1
Aiden is older than Jennifer. Laura is older than Sean. Jones is older than Jennifer. Laura is younger than Bob. Therefore laura is older than Sean.,0
All counts are boats. No counts are rabbits. Therefore all rabbits are boats.,1
Sarah is slower than Dylan. Ernest is slower than Dylan. Sarah is slower than Ernest. Therefore dylan is faster than Ernest.,0
Ernest is less ambitious than Aiden. Victoria is less ambitious than Ernest. Therefore ernest is more ambitious than Victoria.,0
Joanna is less frank than David. Sara is less frank than David. Sophia is less frank than Sara. Therefore sara is less frank than Sophia.,1
All rabbits are aphids. No aphids are lords. Therefore no lords are rabbits.,0
Jill is younger than Peter. Jennifer is older than Peter. Sophia is older than Jill. Sophia is younger than Jones. Therefore peter is older than Jennifer.,1
Caroline is younger than Candice. Candice is younger than Edward. Candice is younger than Kim. Therefore caroline is younger than Edward.,0
Some noelinds are builithes. All noelinds are caimats. Therefore some caimats are builithes.,0
Some cheiliths are rigglays. Some cheiliths are not trealops. Therefore all trealops are rigglays.,1
Some students are magicians. Some rocks are not magicians. Therefore no rocks are students.,1
All sagirds are noxuses. No nimepoes are noxuses. Therefore no nimepoes are sagirds.,0
All bulls are crabs. Some places are not bulls. Therefore no places are crabs.,1
"The US was right to attack Japan after Pearl Harbor, so it was right to attack Iraq after 9/11.",1
Jill is less kind than Moses. Moses is less kind than Rossi. Therefore rossi is kinder than Moses.,0
"You can't prove he's innocent, so he must be guilty.",1
No skizzles are shraiwels. Some shraiwels are pricenanos. Therefore some pricenanos are not skizzles.,0
Vicky is less reliable than Edward. Vicky is less reliable than Cecilia. Edward is less reliable than Moses. Therefore moses is more reliable than Edward.,0
All caterpillers are venusians. Some sidewinders are not venusians. Therefore some sidewinders are not caterpillers.,0
The sun is hottest when the clock reads midday. So the clock must control the temperature of the sun.,1
Some programmers are canines. No programmers are tumtum trees. Therefore some tumtum trees are canines.,1
"I can't imagine a house the size of a planet, so such a thing must be impossible.",1
All kittens are playwrights. Some aliens are playwrights. Therefore no aliens are kittens.,1
Edward is less reliable than Annie. Jones is less reliable than Edward. Kevin is less reliable than Edward. Jennifer is less reliable than Jones. Therefore jones is less reliable than Jennifer.,1
Paul is less ambitious than Lara. Lara is less ambitious than Jones. Therefore jones is more ambitious than Lara.,0
No prottows are effachers. All ocirs are effachers. Therefore no ocirs are prottows.,0
"The nutritionist was overweight, so his advice can't be trusted.",1
Some farklings are bisdoes. Some artrames are not farklings. Therefore some artrames are not bisdoes.,1
No hendassas are hildaids. Some goyances are not hendassas. Therefore some goyances are hildaids.,1
The 2020 version of the product must be better than the 2018 because it's newer.,1
"If we legalise marijuana, we'll inevitably legalise heroin.",1
All salmon are villages. Some salmon are hamlets. Therefore some hamlets are villages.,0
Some tumtum trees are spacemen. All tumtum trees are aliens. Therefore some aliens are spacemen.,0
Jones is less ambitious than Michael. Jones is less ambitious than Nat. Nat is less ambitious than Michael. Peter is less ambitious than Nat. Therefore peter is more ambitious than Nat.,1
No artrames are proppors. Some artrames are spequals. Therefore some spequals are not proppors.,0
No magicians are boats. All heroines are boats. Therefore no heroines are magicians.,0
All dwarves are pants. All salmon are dwarves. Therefore all salmon are pants.,0
Charlotte is less kind than Kevin. Charlotte is less kind than Aiden. Aiden is less kind than Bob. Therefore aiden is kinder than Charlotte.,0
All U.F.O.s are heroines. No teachers are heroines. Therefore no teachers are U.F.O.s.,0
All earthlings are cousins. No cousins are dishes. Therefore no dishes are earthlings.,0
No butchers are shellfish. Some frogs are shellfish. Therefore some frogs are butchers.,1
No nurses are boys. Some places are nurses. Therefore some places are not boys.,0
Some pardees are tupresses. All pardees are glontoms. Therefore some glontoms are tupresses.,0
Some toys are duchesses. All duchesses are girls. Therefore some girls are toys.,0
All benessits are caimats. Some benessits are lotadils. Therefore some lotadils are caimats.,0
Jennifer is wittier than Zach. Sam is wittier than Jennifer. Therefore jennifer is less witty than Zach.,1
My brother told me to stop smoking. But he's a bad guy. So I shouldn't follow his advice.,1
Laura is less frank than Carol. Laura is less frank than Kim. Mario is less frank than Laura. Anne is less frank than Laura. Therefore laura is more frank than Carol.,1
All U.F.O.s are kittens. Some rooms are U.F.O.s. Therefore no rooms are kittens.,1
No younjurs are reggabreas. Some fapsters are reggabreas. Therefore some fapsters are not younjurs.,0
All refluppers are shipotoes. Some sebusses are refluppers. Therefore some sebusses are shipotoes.,0
No pentwests are hawkloons. Some bistups are pentwests. Therefore no bistups are hawkloons.,1
You shouldn't trust Donald's views about politics. He's an alcoholic.,1
No nightmares are restaurants. Some shirts are nightmares. Therefore some shirts are not restaurants.,0
"I can't imagine the universe coming into existence without an act of creation, so atheism must be false.",1
All unfabrans are hislaffs. All prottows are unfabrans. Therefore all prottows are hislaffs.,0
Vicky is faster than Edward. Edward is faster than Sean. Therefore edward is slower than Vicky.,0
No sebusses are dufizzes. Some sebusses are not yudalouds. Therefore some yudalouds are dufizzes.,1
No khavvins are mizules. Some zapsters are khavvins. Therefore all zapsters are mizules.,1
Some strassips are prottows. Some houtals are prottows. Therefore no houtals are strassips.,1
"People encounter financial emergencies all the time, so if you want to ensure you have funds to cover them you should get an emergency fund.",0
All girls are soldiers. Some alligators are not soldiers. Therefore some alligators are not girls.,0
Mario is kinder than Jenny. Zach is kinder than Mario. Therefore jenny is less kind than Mario.,0
Aiden is younger than Moses. Aiden is younger than Sean. Sean is younger than Mario. Therefore aiden is older than Mario.,1
Rossi is more frank than Peter. Jim is more frank than Peter. Mario is more frank than Jim. Therefore jim is less frank than Peter.,1
This man is an immigrant and committed a crime. So immigrants commit crimes.,1
All guys are snarks. No guys are skeptics. Therefore all skeptics are snarks.,1
All priests are authors. All acrobats are priests. Therefore all acrobats are authors.,0
Mary is kinder than Edward. Jack is kinder than Mary. Therefore jack is less kind than Mary.,1
Henry is shorter than Michael. Bill is shorter than Henry. Carol is shorter than Bill. Bill is taller than Bella. Therefore michael is taller than Bella.,0
Some capitols are ministers. Some queens are ministers. Therefore all queens are capitols.,1
Jake is less sensible than William. Sara is less sensible than William. William is less sensible than Edward. Edward is less sensible than Ernest. Therefore ernest is less sensible than Sara.,1
Dylan is more frank than Kevin. Kevin is more frank than Anna. Therefore kevin is less frank than Dylan.,0
Jake is less sensible than Charlotte. Bob is less sensible than Charlotte. Laura is less sensible than Bob. Paul is less sensible than Bob. Therefore paul is less sensible than Charlotte.,0
"Marriage has been part of human society for ten thousand years, so its decline must be a bad thing.",1
Some sagirds are not chevesics. No sagirds are dorchies. Therefore no dorchies are chevesics.,1
"The Beatles sold more record than any other band, so they're the best musicians of all time.",1
Jill is kinder than Anne. Rossi is kinder than Jill. Therefore anne is kinder than Jill.,1
All gaxes are hawkloons. All gaxes are sevvits. Therefore some sevvits are not hawkloons.,1
"The last train leaves soon, and you said you didn't want to miss it, so you should head out shortly.",0
All brewtines are looplats. Some yoffas are not looplats. Therefore some yoffas are not brewtines.,0
All lotadils are sebusses. Some noxuses are not sebusses. Therefore some noxuses are not lotadils.,0
Dylan is younger than Mario. Mario is younger than Nat. Jake is younger than Bob. Therefore mario is younger than Dylan.,1
No musicians are sparrows. All plays are musicians. Therefore no plays are sparrows.,0
No vicars are crabs. Some oaks are vicars. Therefore some oaks are not crabs.,0
No ants are butchers. Some ants are poets. Therefore some poets are not butchers.,0
Anne is more reliable than Moses. Jake is more reliable than Anne. Carol is more reliable than Jake. Carol is more reliable than John. Therefore jake is more reliable than Carol.,1
Amy is older than Sarah. Rossi is older than Amy. Therefore amy is younger than Rossi.,0
All pardees are dreanors. Some werradiths are not dreanors. Therefore no werradiths are pardees.,1
Some nuns are mustangs. All nuns are harlequins. Therefore some harlequins are mustangs.,0
Tom is younger than William. Susan is younger than Tom. Therefore tom is older than William.,1
Henry is less kind than Sophia. Sophia is less kind than Anne. Anne is less kind than Susan. Therefore henry is less kind than Anne.,0
Some ranotots are not spewsies. All ranotots are proppors. Therefore some proppors are not spewsies.,0
Paul is less ambitious than Osbert. Osbert is less ambitious than Susan. Therefore susan is more ambitious than Osbert.,0
Some noelinds are not kitzerains. No noelinds are didizas. Therefore all didizas are kitzerains.,1
Some goblins are uncles. All goblins are actors. Therefore some actors are uncles.,0
"She knows a lot about mathematics, so I'll ask her about this mathematical problem",0
Jill is more ambitious than Jake. Jake is less ambitious than Cecilia. Jill is more ambitious than Cecilia. Therefore jill is less ambitious than Jake.,1
Some pants are not relatives. All pants are fruit flies. Therefore some fruit flies are not relatives.,0
All tortoises are majors. No pens are tortoises. Therefore all pens are majors.,1
Paul is more ambitious than Jennifer. Vicky is more ambitious than Marcus. Paul is more ambitious than Vicky. Therefore paul is more ambitious than Marcus.,0
Some cubs are not bats. All sisters are bats. Therefore some sisters are not cubs.,1
Some champions are not asteroids. No champions are jovians. Therefore some jovians are asteroids.,1
All kings are auditoriums. Some kings are paintings. Therefore some paintings are auditoriums.,0
"IQ tests were developed to help developmentally delayed children, so they can't be useful for normal adults.",1
No daisies are kitchens. No kitchens are princes. Therefore no princes are daisies.,1
Some kirarics are unfabrans. All unfabrans are shipotoes. Therefore no shipotoes are kirarics.,1
No wizards are spiders. Some horses are wizards. Therefore some horses are spiders.,1
Anne is more frank than Jennifer. Anne is more frank than Jones. Jennifer is more frank than Anna. Therefore anne is more frank than Anna.,0
Some elves are not colts. Some cowgirls are elves. Therefore some cowgirls are not colts.,1
Some shures are zapsters. All zapsters are lotadils. Therefore some lotadils are shures.,0
Some shipotoes are brewtines. No prottows are shipotoes. Therefore no prottows are brewtines.,1
Henry is shorter than Michael. Bill is shorter than Henry. Carol is shorter than Bill. Bill is taller than Bella. Therefore bill is shorter than Carol.,1
Some nurses are animals. No scouts are animals. Therefore some scouts are nurses.,1
Have you seen how ugly that guy is? We can't take his claims seriously.,1
No zapsters are tingforms. All natances are tingforms. Therefore no natances are zapsters.,0
"Seasonal depression is worst in November. Next month is December, so it might be a bad month for Seasonal Depression.",0
"You said marijuana should be legalised, so you clearly think it's okay to take heroin.",1
John is slower than Rossi. Sam is faster than Rossi. John is slower than Dylan. Therefore rossi is faster than John.,0
No bowls are jesters. Some cats are bowls. Therefore some cats are not jesters.,0
Jim is more sensible than Peter. Jill is more sensible than Peter. Aiden is more sensible than Anne. Peter is more sensible than Anne. Therefore peter is less sensible than Jill.,0
Mario is younger than Nat. Vicky is younger than Mario. Vicky is younger than Marcus. Vicky is younger than Sara. Therefore sara is younger than Vicky.,1
"Lotteries have been practicised since time immemorial, so they can hardly be immoral.",1
No gaxes are effachers. Some effachers are confras. Therefore some confras are not gaxes.,0
No dens are forks. All lassies are dens. Therefore no lassies are forks.,0
No benessits are compleys. Some hawkloons are compleys. Therefore some hawkloons are not benessits.,0
Candice is less frank than Philipp. Tom is more frank than Philipp. Therefore tom is more frank than Philipp.,0
Henry is less kind than Sophia. Sophia is less kind than Anne. Anne is less kind than Susan. Therefore sophia is less kind than Henry.,1
Some insects are knaves. All insects are goats. Therefore some goats are knaves.,0
Some skrads are not flionsoes. All polinks are skrads. Therefore no polinks are flionsoes.,1
"I have the right to drink beer all day, so it's only right that I drink beer all day.",1
Charlotte is more sensible than John. Bella is more sensible than Charlotte. Charlotte is less sensible than Tom. Therefore charlotte is less sensible than John.,1
Zach is less witty than Moses. William is less witty than Ernest. Ernest is less witty than Moses. Therefore william is less witty than Moses.,0
"He's the King of France, so his opinions about haircare must be accurate.",1
"The Liberal Party has more members than the Conservative party, so its views must be more justified.",1
Some glontoms are spewsies. All glontoms are pentwests. Therefore some pentwests are spewsies.,0
All flionsoes are unfabrans. Some noxuses are unfabrans. Therefore some noxuses are flionsoes.,1
"If we cut salaries this year, we'll never get a pay rise again.",1
All dewfays are polinks. All thrastles are dewfays. Therefore all thrastles are polinks.,0
All fathers are swans. No swans are mares. Therefore no mares are fathers.,0
All dreams are shirts. No dreams are brunettes. Therefore no brunettes are shirts.,1
All tolities are treyples. All prottows are tolities. Therefore all prottows are treyples.,0
All tupresses are shipotoes. Some tupresses are sypholoes. Therefore no sypholoes are shipotoes.,1
William is less reliable than Sam. Candice is more reliable than Sam. Candice is less reliable than Bella. Vicky is more reliable than William. Therefore william is more reliable than Candice.,1
Some pencils are amphibians. All princesses are amphibians. Therefore some princesses are not pencils.,1
No dufizzes are mincoms. Some dufizzes are taindists. Therefore some taindists are not mincoms.,0
All spewsies are didizas. Some smations are spewsies. Therefore no smations are didizas.,1
"If we cut taxes by 1%, we'll have to cut them more and more until we abolish them entirely.",1
"If we buy a new sofa, we'll have to buy a new chair.",1
All calves are boats. No boats are rockets. Therefore no rockets are calves.,0
No lions are owls. Some owls are lambs. Therefore some lambs are not lions.,0
Edward is shorter than Carol. Paul is shorter than Edward. Therefore edward is taller than Carol.,1
"You said marijuana should be legalised, so you clearly think it's okay to take heroin.",1
No trands are novalies. Some novalies are ocirs. Therefore some ocirs are not trands.,0
You should trust my views about American politics because I have a PhD in material science.,1
All clones are mammals. Some clones are queens. Therefore some queens are mammals.,0
All tupresses are shipotoes. Some tupresses are sypholoes. Therefore no sypholoes are shipotoes.,1
Peter is slower than Jack. Sophia is slower than Jack. Henry is slower than Sophia. Henry is slower than Peter. Therefore peter is faster than Henry.,0
Mario is more reliable than Jill. Jill is more reliable than Michael. Therefore michael is more reliable than Jill.,1
No nightmares are forks. Some captains are forks. Therefore some captains are not nightmares.,0
Moses is shorter than Sara. Charlotte is shorter than Moses. Debbie is taller than Moses. Robert is shorter than Charlotte. Therefore sara is taller than Robert.,0
No gaxes are effachers. Some effachers are confras. Therefore some confras are not gaxes.,0
Some surogous are not mizules. No werradiths are surogous. Therefore all werradiths are mizules.,1
Some farklings are not froilets. No froilets are reggabreas. Therefore some reggabreas are not farklings.,1
Sophia is kinder than Amy. Sophia is less kind than Caroline. Caroline is kinder than Jim. Therefore caroline is kinder than Amy.,0
All alligators are people. Some chimpanzees are alligators. Therefore some chimpanzees are people.,0
All bisdoes are sevvits. All dufizzes are bisdoes. Therefore all dufizzes are sevvits.,0
No spewsies are looncans. All smations are looncans. Therefore no smations are spewsies.,0
No shepherds are arachnids. Some venusians are shepherds. Therefore no venusians are arachnids.,1
Marcus is older than Jennifer. Joanna is older than Marcus. Lara is older than Jenny. Susan is older than Jenny. Therefore jennifer is older than Marcus.,1
Laura is less frank than Carol. Laura is less frank than Kim. Mario is less frank than Laura. Anne is less frank than Laura. Therefore carol is more frank than Laura.,0
Cecilia is more sensible than Bob. Jake is more sensible than Cecilia. Anna is more sensible than Candice. Aiden is less sensible than Anna. Therefore anna is more sensible than Aiden.,0
Edward is shorter than Carol. Paul is shorter than Edward. Therefore edward is taller than Paul.,0
