text,label
No bisdoes are hawkloons. Some tingforms are bisdoes. Therefore all tingforms are hawkloons.,1
Henry is less kind than Sophia. Sophia is less kind than Anne. Anne is less kind than Susan. Therefore henry is less kind than Anne.,0
Some bakers are cities. Some cities are oaks. Therefore all oaks are bakers.,1
All students are kids. Some auditoriums are not kids. Therefore some auditoriums are not students.,0
Amy is more ambitious than Mario. Mario is more ambitious than Victoria. Mario is more ambitious than Joanna. Victoria is more ambitious than Kim. Therefore amy is more ambitious than Kim.,0
If you break your vegetarianism to eat chicken you'll soon end up eating beef.,1
No shizzoes are unfabrans. Some mincoms are unfabrans. Therefore some mincoms are not shizzoes.,0
Nat is taller than Aiden. Jennifer is taller than Jill. Jill is taller than Nat. Sara is taller than Nat. Therefore nat is shorter than Aiden.,1
"Night follows day, so the day must cause the night.",1
Lara is wittier than Jack. Jennifer is wittier than Lara. Jennifer is less witty than Kim. Jennifer is less witty than Rossi. Therefore jennifer is wittier than Lara.,0
No smurtans are fapsters. Some smurtans are houtals. Therefore some houtals are fapsters.,1
No sharks are candlestick makers. All countesses are candlestick makers. Therefore no countesses are sharks.,0
Sara is faster than Caroline. Sara is slower than Sarah. Marcus is slower than Anna. Therefore caroline is faster than Sara.,1
Some nurses are nightmares. All nightmares are tortoises. Therefore some tortoises are nurses.,0
All candlestick makers are snails. Some jubjub birds are not snails. Therefore no jubjub birds are candlestick makers.,1
No chevesics are lotadils. No winnibler are chevesics. Therefore all winnibler are lotadils.,1
All prottows are brongs. All spoickles are prottows. Therefore all spoickles are brongs.,0
"Snakes are temperamental pets, and as warm blooded animals they require careful maintenance.",0
Mario is slower than Laura. Henry is slower than Peter. Laura is slower than Peter. Therefore mario is slower than Peter.,0
No shizzoes are unfabrans. Some mincoms are unfabrans. Therefore some mincoms are not shizzoes.,0
No butchers are shellfish. Some frogs are shellfish. Therefore some frogs are butchers.,1
All essups are houtals. No houtals are tingforms. Therefore no tingforms are essups.,0
She's having a good time at the party. So that's why she wants to stay longer.,0
Some reilts are smurtans. All reilts are swoofles. Therefore some swoofles are smurtans.,0
No brewtines are zestponts. All compleys are zestponts. Therefore no compleys are brewtines.,0
No aferrarons are didizas. No didizas are unfabrans. Therefore some unfabrans are not aferrarons.,1
Tom is younger than William. Susan is younger than Tom. Therefore william is older than Tom.,0
No felines are apartments. No asteroids are apartments. Therefore some asteroids are not felines.,1
All wasps are bunnies. No bunnies are teachers. Therefore no teachers are wasps.,0
Laura is less witty than Sara. Sara is less witty than Kim. Sara is less witty than David. Therefore david is less witty than Sara.,1
No cubs are hornets. Some hornets are plants. Therefore some plants are not cubs.,0
Ernest is older than Philipp. Philipp is older than Peter. Ernest is older than Peter. Kevin is older than Ernest. Therefore kevin is older than Peter.,0
Some noelinds are builithes. All noelinds are caimats. Therefore some caimats are builithes.,0
All planets are bishops. No bishops are dogs. Therefore no dogs are planets.,0
"Modern rockets were developed in Nazi Germany, so rocketry is an evil science.",1
Some onamas are tograshs. All tograshs are yudalouds. Therefore some yudalouds are onamas.,0
Anne is less kind than Tom. Nat is less kind than Laura. Susan is kinder than Edward. Anne is less kind than Nat. Therefore laura is kinder than Anne.,0
All tupresses are sagirds. All tupresses are styphons. Therefore some styphons are not sagirds.,1
Osbert is kinder than Bella. Aiden is less kind than Sam. Kevin is kinder than Lara. Kevin is kinder than Sam. Therefore aiden is kinder than Kevin.,1
William is less reliable than Laura. Bill is less reliable than Cecilia. Sean is less reliable than Aiden. Aiden is less reliable than Laura. Therefore cecilia is more reliable than Bill.,0
All reptilians are adults. Some reptilians are places. Therefore some places are adults.,0
Some toves are asteroids. All asteroids are tigers. Therefore some tigers are toves.,0
Anne is more frank than Jennifer. Anne is more frank than Jones. Jennifer is more frank than Anna. Therefore anne is more frank than Anna.,0
Some smations are noelinds. Some sevvits are smations. Therefore no sevvits are noelinds.,1
No playwrights are candlestick makers. Some playwrights are foo fighters. Therefore some foo fighters are not candlestick makers.,0
No fapsters are nimepoes. All didizas are nimepoes. Therefore no didizas are fapsters.,0
No winoozes are gaxes. Some spoickles are winoozes. Therefore some spoickles are not gaxes.,0
Some gryllows are not skrads. All skrads are rigglays. Therefore all rigglays are gryllows.,1
Some clothes are goblins. All firemen are clothes. Therefore some firemen are not goblins.,1
Osbert is slower than William. Philipp is slower than Peter. Sarah is slower than Philipp. Bill is slower than Peter. Therefore sarah is slower than Peter.,0
Lara is more sensible than Sara. Joanna is more sensible than Sara. Candice is more sensible than Joanna. Candice is more sensible than Peter. Therefore sara is more sensible than Joanna.,1
Some skrads are not flionsoes. All polinks are skrads. Therefore no polinks are flionsoes.,1
Paul is more frank than Bob. Paul is less frank than Annie. Therefore paul is more frank than Bob.,0
Some horses are aunts. Some birds are not aunts. Therefore all birds are horses.,1
All knives are lords. No knives are lions. Therefore some lions are not lords.,1
Some witches are jovians. All witches are hawks. Therefore some hawks are jovians.,0
Bella is less sensible than Rossi. Joanna is less sensible than Rossi. Joanna is less sensible than Bella. Therefore bella is more sensible than Joanna.,0
Anne is wittier than Nat. Anne is less witty than Jim. Jim is less witty than Jill. David is wittier than Jill. Therefore nat is wittier than Anne.,1
All calves are boats. No boats are rockets. Therefore no rockets are calves.,0
All pets are mustangs. No mustangs are dreams. Therefore no dreams are pets.,0
No firemen are hamburgers. Some shirts are firemen. Therefore some shirts are hamburgers.,1
No scouts are rockets. Some scouts are lion tamers. Therefore some lion tamers are not rockets.,0
Some plutonians are reptiles. All plutonians are towns. Therefore some towns are reptiles.,0
No spewsies are builithes. All winnibler are builithes. Therefore no winnibler are spewsies.,0
Jake is less sensible than Charlotte. Bob is less sensible than Charlotte. Laura is less sensible than Bob. Paul is less sensible than Bob. Therefore paul is less sensible than Charlotte.,0
No theaters are alligators. Some lads are not theaters. Therefore all lads are alligators.,1
The 2020 version of the product must be better than the 2018 because it's newer.,1
No brewtines are slozzoms. All dorchies are slozzoms. Therefore no dorchies are brewtines.,0
Amy is more ambitious than David. Nat is more ambitious than Amy. Therefore amy is more ambitious than Nat.,1
All programmers are rooks. All amphibians are programmers. Therefore all amphibians are rooks.,0
No sypholoes are noxuses. Some noxuses are pentwests. Therefore some pentwests are not sypholoes.,0
Some hornets are not programmers. Some hornets are stadiums. Therefore no stadiums are programmers.,1
Some pentwests are hildaids. All hildaids are fluffsters. Therefore some fluffsters are pentwests.,0
Some essups are treyples. No spewsies are essups. Therefore some spewsies are not treyples.,1
"You said we need to help animals, so you clearly don't care about humans.",1
Robert is taller than Amy. Osbert is taller than Robert. Mary is taller than Robert. Therefore osbert is taller than Amy.,0
All ants are adults. No adults are plutonians. Therefore no plutonians are ants.,0
No photographs are males. Some catfish are males. Therefore some catfish are photographs.,1
Some harlequins are heroines. No swans are harlequins. Therefore some swans are not heroines.,1
No firemen are shellfish. Some guys are shellfish. Therefore some guys are firemen.,1
"My drug test was positive, and positive things are good. So my test result was good.",1
Some shipotoes are not rigglays. All mincoms are rigglays. Therefore some mincoms are shipotoes.,1
Mario is slower than Laura. Henry is slower than Peter. Laura is slower than Peter. Therefore mario is slower than Peter.,0
Nuclear power was developed by some of the same scientists who built the atom bomb; it can't be safe.,1
No shizzoes are zestponts. All benessits are shizzoes. Therefore no benessits are zestponts.,0
No lions are soldiers. All admirals are lions. Therefore no admirals are soldiers.,0
All compleys are natances. Some compleys are aferrarons. Therefore some aferrarons are natances.,0
No benessits are swinducts. Some benessits are lotadils. Therefore some lotadils are not swinducts.,0
"Picnics are generally better in hot weather, so the ideal time for a UK picnic is July",0
All goats are jesters. No jesters are hamburgers. Therefore no hamburgers are goats.,0
Anne is less reliable than Edward. Sara is less reliable than Kim. Edward is less reliable than Carol. Therefore kim is less reliable than Sara.,1
"I've never heard of any French astronauts, so there must not be any.",1
No photographs are males. Some catfish are males. Therefore some catfish are photographs.,1
"Referees are supposed to be neutral. The referee is from Switzerland, a neutral country, so he must be neutral.",1
Some programs are scouts. All scouts are caterpillers. Therefore some caterpillers are programs.,0
Jennifer is less kind than David. David is less kind than Edward. Therefore david is kinder than Jennifer.,0
All salmon are villages. Some salmon are hamlets. Therefore some hamlets are villages.,0
No gryllows are novalies. All froilets are gryllows. Therefore no froilets are novalies.,0
William is less frank than Mario. Tim is less frank than Mario. Anna is less frank than Tim. Therefore mario is more frank than William.,0
No hendassas are pentwests. Some prottows are hendassas. Therefore some prottows are not pentwests.,0
Joanna is more frank than Paul. Sean is more frank than Paul. Aiden is more frank than Joanna. Therefore joanna is more frank than Aiden.,1
No blonds are warlocks. Some spoons are blonds. Therefore some spoons are not warlocks.,0
No hamburgers are bishops. No hamburgers are bunnies. Therefore all bunnies are bishops.,1
No chickens are boa constrictors. All boa constrictors are duchesses. Therefore no duchesses are chickens.,1
Some flies are not bees. All flies are hawks. Therefore some hawks are not bees.,0
No uncles are sons. Some paintings are uncles. Therefore some paintings are sons.,1
All tupresses are exastoes. No exastoes are hislaffs. Therefore no hislaffs are tupresses.,0
Some gorillas are not spoons. No spoons are bishops. Therefore no bishops are gorillas.,1
No cats are hobgoblins. Some calves are cats. Therefore some calves are not hobgoblins.,0
Some surogous are not mizules. No werradiths are surogous. Therefore all werradiths are mizules.,1
Anne is less kind than Tom. Nat is less kind than Laura. Susan is kinder than Edward. Anne is less kind than Nat. Therefore nat is kinder than Laura.,1
Some minors are not insects. All sparrows are insects. Therefore some sparrows are minors.,1
She's having a good time at the party. So that's why she wants to stay longer.,0
Some nurses are nightmares. All nightmares are tortoises. Therefore some tortoises are nurses.,0
Osbert is slower than William. Philipp is slower than Peter. Sarah is slower than Philipp. Bill is slower than Peter. Therefore osbert is faster than William.,1
All reilts are benessits. Some dreanors are reilts. Therefore some dreanors are benessits.,0
All sayplomps are weepeggles. No weepeggles are brewtines. Therefore all brewtines are sayplomps.,1
All fapsters are trealops. No prottows are trealops. Therefore no prottows are fapsters.,0
Lara is more frank than Bob. Bob is more frank than Marcus. Therefore marcus is less frank than Bob.,0
No authors are elves. All warlocks are authors. Therefore no warlocks are elves.,0
Victoria is kinder than Sam. Caroline is kinder than Sam. Edward is kinder than Caroline. David is kinder than Edward. Therefore david is kinder than Sam.,0
Some ocirammas are looplats. All looplats are kirarics. Therefore some kirarics are ocirammas.,0
Mary is kinder than Edward. Jack is kinder than Mary. Therefore mary is less kind than Jack.,0
All smations are taindists. Some hildaids are smations. Therefore some hildaids are taindists.,0
Moses is less witty than Tom. Tom is less witty than William. Therefore tom is wittier than Moses.,0
No children are canines. Some boys are canines. Therefore some boys are not children.,0
All gerants are rodrups. All houtals are gerants. Therefore all houtals are rodrups.,0
All sharks are wasps. No rocks are wasps. Therefore some rocks are sharks.,1
No yoffas are spequals. Some proppors are spequals. Therefore no proppors are yoffas.,1
Some offices are not capitols. All offices are playwrights. Therefore some playwrights are not capitols.,0
All dogs are hobgoblins. No capitols are hobgoblins. Therefore no capitols are dogs.,0
Some cows are nuns. No nuns are queens. Therefore no queens are cows.,1
All hislaffs are zapsters. Some zapsters are not confras. Therefore some confras are hislaffs.,1
Jenny is less ambitious than John. John is less ambitious than Sara. Therefore sara is more ambitious than John.,0
No hamburgers are bishops. No hamburgers are bunnies. Therefore all bunnies are bishops.,1
No rodrups are bisdoes. All strizzings are bisdoes. Therefore some strizzings are rodrups.,1
"Mexican food is heavy on spice, so if you want something plainer, you might try English cuisine instead.",0
All effachers are fluffsters. No winnibler are fluffsters. Therefore some winnibler are effachers.,1
Some sevvits are broomillas. No sevvits are swinducts. Therefore some swinducts are not broomillas.,1
All sposities are dewfays. Some eunolgies are not dewfays. Therefore some eunolgies are not sposities.,0
"Genetic engineering involves tampering with nature, so it can't be ethically justified.",1
No writers are siblings. All capitols are siblings. Therefore no capitols are writers.,0
Some males are not fish. Some taxi cabs are fish. Therefore some taxi cabs are not males.,1
"If we let global warming increase by 1 degree, it will increase by 2 degrees, and 3 degrees.",1
All styphons are snabeths. Some proppors are styphons. Therefore some proppors are snabeths.,0
All flionsoes are shipotoes. Some flionsoes are looncans. Therefore some looncans are shipotoes.,0
Robert is faster than Paul. Paul is faster than Anne. Therefore paul is slower than Robert.,0
All sinpuds are shures. Some sinpuds are pardees. Therefore some pardees are shures.,0
No clowns are soldiers. All tuna are soldiers. Therefore some tuna are clowns.,1
Jennifer is less kind than David. David is less kind than Edward. Therefore jennifer is kinder than David.,1
Zach is faster than Michael. Jennifer is faster than Candice. Candice is faster than Michael. Therefore jennifer is faster than Michael.,0
"You're telling me not to start smoking, but you smoke yourself, so I shouldn't listen to your advice.",1
No dufizzes are werradiths. All taindists are werradiths. Therefore no taindists are dufizzes.,0
"If you liked that book, you should check out other works by the same author.",0
Paul is less ambitious than Osbert. Osbert is less ambitious than Susan. Therefore susan is more ambitious than Osbert.,0
Susan is less reliable than Caroline. Sophia is more reliable than Jack. Sophia is less reliable than Joanna. Caroline is less reliable than Joanna. Therefore joanna is more reliable than Susan.,0
Mario is slower than Laura. Henry is slower than Peter. Laura is slower than Peter. Therefore laura is faster than Peter.,1
"India and China are the two largest countries, and they eat a lot of rice, so rice must be better than bread.",1
Dylan is less reliable than Tim. Charlotte is less reliable than Dylan. Therefore dylan is more reliable than Tim.,1
All reptilians are adults. Some reptilians are places. Therefore some places are adults.,0
Zach is less witty than Moses. William is less witty than Ernest. Ernest is less witty than Moses. Therefore william is less witty than Moses.,0
Some rocks are not colts. No animals are colts. Therefore some animals are not rocks.,1
All tograshs are ranotots. Some ranotots are not fluffsters. Therefore some fluffsters are tograshs.,1
No oaks are humans. Some oaks are countesses. Therefore some countesses are not humans.,0
Aiden is older than Jennifer. Laura is older than Sean. Jones is older than Jennifer. Laura is younger than Bob. Therefore bob is younger than Laura.,1
"The computer revolution really got going around the same time as punk, so I guess punk music led to better computers.",1
No nieces are lads. Some mailmen are lads. Therefore some mailmen are not nieces.,0
All onamas are reggabreas. No confras are reggabreas. Therefore no confras are onamas.,0
Nat is taller than Aiden. Jennifer is taller than Jill. Jill is taller than Nat. Sara is taller than Nat. Therefore jennifer is taller than Aiden.,0
All onamas are taindists. No taindists are noxuses. Therefore some noxuses are onamas.,1
No lotadils are sagirds. No lotadils are bistups. Therefore some bistups are not sagirds.,1
All kings are auditoriums. Some kings are paintings. Therefore some paintings are auditoriums.,0
All champions are princes. All princes are toadstools. Therefore some toadstools are not champions.,1
Marcus is faster than Annie. Annie is faster than Kevin. Therefore annie is slower than Kevin.,1
Some programmers are spacemen. Some spacemen are children. Therefore some children are programmers.,1
Kevin is more sensible than Peter. Annie is more sensible than Kevin. Dylan is more sensible than Jennifer. Michael is more sensible than Dylan. Therefore jennifer is more sensible than Dylan.,1
Aiden is younger than Moses. Aiden is younger than Sean. Sean is younger than Mario. Therefore aiden is older than Mario.,1
Some goblins are not rabbits. All goblins are boojums. Therefore some boojums are not rabbits.,0
Some hildaids are nalpures. All nalpures are werradiths. Therefore some werradiths are hildaids.,0
Jake is less sensible than Charlotte. Bob is less sensible than Charlotte. Laura is less sensible than Bob. Paul is less sensible than Bob. Therefore paul is more sensible than Charlotte.,1
You said that excessive regulation hurts business. You clearly don't care about workers at all.,1
Sophia is slower than Carol. Joanna is slower than Sophia. Candice is slower than Sophia. Tim is slower than Jennifer. Therefore jennifer is slower than Tim.,1
All venusians are knights. No venusians are minors. Therefore some minors are not knights.,1
"My drug test was positive, and positive things are good. So my test result was good.",1
No prottows are effachers. All ocirs are effachers. Therefore no ocirs are prottows.,0
All bedrooms are caterpillers. Some cowboys are bedrooms. Therefore some cowboys are caterpillers.,0
No skizzles are novalies. No skizzles are smurtans. Therefore some smurtans are not novalies.,1
"Border collies require a lot of exercise, so if you're unable to take them for regular walks, you might be better off getting a different sort of pet.",0
Joanna is older than Moses. Tom is younger than Bill. Joanna is younger than Bill. Jake is younger than Moses. Therefore joanna is younger than Jake.,1
John is a famous war hero. So we should trust what John says about politics.,1
Annie is taller than Dylan. Cecilia is shorter than Anna. Dylan is taller than Vicky. Vicky is shorter than Jake. Therefore annie is taller than Vicky.,0
No bisdoes are billians. Some bisdoes are jerens. Therefore some jerens are not billians.,0
Mario is less witty than Osbert. Jim is less witty than Kim. Osbert is less witty than Kim. Therefore mario is less witty than Kim.,0
Cecilia is more sensible than Bob. Jake is more sensible than Cecilia. Anna is more sensible than Candice. Aiden is less sensible than Anna. Therefore anna is less sensible than Aiden.,1
All sayplomps are weepeggles. No weepeggles are brewtines. Therefore all brewtines are sayplomps.,1
Henry is less sensible than Carol. Henry is less sensible than Candice. Candice is less sensible than Jill. Therefore henry is more sensible than Carol.,1
Some goblins are uncles. All goblins are actors. Therefore some actors are uncles.,0
No cows are possums. Some jets are possums. Therefore some jets are not cows.,0
"If we let in this refugee, we'll have to let in thousands more, and before you know it we'll have open borders.",1
No nightmares are restaurants. Some shirts are nightmares. Therefore some shirts are not restaurants.,0
"The city was founded two hundred years ago by a notorious racist, so it must still be a racist place.",1
"Archers played a key role at the battle of Agincourt; if it hadn't been for them, the English might have lost.",0
"A survey of climate experts suggests overwhelming support for this policy. They could be wrong, but it's at least one argument in its favour.",0
Some khavvins are fluffsters. No cheiliths are fluffsters. Therefore no cheiliths are khavvins.,1
Some wasps are lords. Some wasps are not skeptics. Therefore some skeptics are not lords.,1
Some offices are not capitols. All offices are playwrights. Therefore some playwrights are not capitols.,0
Susan is less reliable than Sarah. Alex is less reliable than Susan. Therefore susan is more reliable than Sarah.,1
No strizzings are braties. All braties are trands. Therefore all trands are strizzings.,1
All nightmares are photographs. All crabs are nightmares. Therefore no crabs are photographs.,1
Mario is kinder than Jenny. Zach is kinder than Mario. Therefore jenny is less kind than Mario.,0
Susan is shorter than Anne. John is shorter than Susan. Therefore susan is taller than Anne.,1
Anne is less ambitious than Lara. Bella is less ambitious than Lara. Henry is less ambitious than Bella. Therefore lara is less ambitious than Bella.,1
Some cowboys are spacemen. Some spacemen are snarks. Therefore all snarks are cowboys.,1
No skrads are slozzoms. Some skrads are strizzings. Therefore some strizzings are not slozzoms.,0
John is slower than Rossi. Sam is faster than Rossi. John is slower than Dylan. Therefore john is faster than Dylan.,1
Moses is kinder than Zach. Zach is kinder than Susan. Zach is kinder than Laura. Therefore zach is less kind than Susan.,1
Some guys are owls. All owls are lion tamers. Therefore some lion tamers are guys.,0
Some computers are not elms. Some computers are spooks. Therefore no spooks are elms.,1
Marcus is older than Amy. Marcus is older than Michael. William is older than Debbie. Amy is older than William. Therefore michael is older than Marcus.,1
No calves are felines. All dogs are calves. Therefore no dogs are felines.,0
Mario is more reliable than Jill. Jill is more reliable than Michael. Therefore michael is less reliable than Jill.,0
All besloors are benessits. All benessits are farklings. Therefore all farklings are besloors.,1
"The law has never recoggised an AI as a person before, so it has no good reason to do so in future",1
Some skizzles are not reilts. All skizzles are sinpuds. Therefore some sinpuds are not reilts.,0
All elms are brothers. No elms are clones. Therefore no clones are brothers.,1
Some rodrups are sagirds. All rodrups are tingforms. Therefore some tingforms are sagirds.,0
Jake is less sensible than Charlotte. Bob is less sensible than Charlotte. Laura is less sensible than Bob. Paul is less sensible than Bob. Therefore paul is more sensible than Charlotte.,1
No tingforms are confras. No yoffas are confras. Therefore no yoffas are tingforms.,1
No starfish are plutonians. All redheads are plutonians. Therefore no redheads are starfish.,0
All compleys are natances. Some compleys are aferrarons. Therefore some aferrarons are natances.,0
Amy is older than Sarah. Rossi is older than Amy. Therefore amy is younger than Sarah.,1
Mario is kinder than Jenny. Zach is kinder than Mario. Therefore jenny is kinder than Mario.,1
"We shouldn't change our country's flag, because it's been like that for hundreds of years.",1
Cecilia is more reliable than Susan. Bill is more reliable than Cecilia. Tom is more reliable than Susan. Therefore bill is more reliable than Susan.,0
Some compleys are ocirs. All hendassas are ocirs. Therefore no hendassas are compleys.,1
Jill is less witty than Laura. Alex is less witty than Laura. Jill is less witty than Charlotte. Jill is less witty than Alex. Therefore charlotte is wittier than Jill.,0
Some pricenanos are ocirs. Some hislaffs are pricenanos. Therefore all hislaffs are ocirs.,1
Some primates are not bedrooms. All primates are nephews. Therefore some nephews are bedrooms.,1
No artrames are farklings. Some noxuses are artrames. Therefore some noxuses are not farklings.,0
All rigglays are compleys. Some hildaids are not compleys. Therefore some hildaids are rigglays.,1
Some houtals are brongs. No houtals are confras. Therefore some confras are not brongs.,1
Some benessits are reilts. All reilts are eunolgies. Therefore some eunolgies are benessits.,0
Mario is kinder than Jenny. Zach is kinder than Mario. Therefore jenny is kinder than Mario.,1
Some sparrows are wizards. All sparrows are dishes. Therefore some dishes are wizards.,0
