text,label
"Teaching assistant: the homework assignment was much harder than we thought, so I think we should give a few extra points to students who completed it. Professor: that’s a terrible idea. If we give everyone a perfect score for no reason, students won’t bother working hard in the future.",fallacy of extension
"I saw Ashton Kutcher in a prescription drug commercial, therefore it has to be an effective drug.",fallacy of credibility
This happens when you assume that something is acceptable just because it is very common.,ad populum
"If you are a true American, you will ask your congressman to vote against NAFTA.",ad populum
Brandon: We should have tastier lunches! Jaylen: Don't listen to him! He's a terrible person! I saw him trip another student and steal his lunch money!,ad hominem
"We haven’t found King David’s tomb, so King David didn’t really exist.",intentional
"Mrs. Miller taught your older brother, who was the class clown. She decides to be strict with you from the very first day of class because she thinks you will be a clown, too.",faulty generalization
This is the best foot cream on the market because no other foot cream makers have been able to prove otherwise!,intentional
"""You're not feeling well because you use your phone so much.""",false causality
"Prof. Jones: ""The university just cut our yearly budget by $10,000."" Prof. Smith: ""What are we going to do?"" Prof. Brown: ""I think we should eliminate one of the teaching assistant positions. That would take care of it."" Prof. Jones: ""We could reduce our scheduled raises instead."" Prof. Brown: "" I can't understand why you want to bleed us dry like that, Jones.""",fallacy of extension
"If we don't control Covid-19, it could lead to millions of deaths. Wouldn't it make you sad to live in a country where that had happened?",appeal to emotion
"John says that Kentucky will beat Florida, but John sometimes lies, so I'm not sure.",ad hominem
"“The rooster crows always before the sun rises, therefore the crowing rooster causes the sun to rise.”",false causality
"P1. Lead poisoning can contribute to violent behavior. P2. Many inner city children have dangerous levels of lead in their blood. C. Therefore, violent crime in the inner city can be solved by curing the lead problem.",false causality
"Steve: In Sweden, college is free for citizens. How come we can't do that here? Ed: If you like Sweden so much, move there. The USA would be glad to be rid of your liberal ass!",ad hominem
The President said he will not allow disrespectful dissent.,circular reasoning
"""Our planet is going to be destroyed! People are creating too much waste, the temperature will continue to rise, natural disasters will occur more frequently, the animals will starve to death, and the planet will basically turn into Venus!""",faulty generalization
This movie was #1 at the box office last weekend! That means it must be really good!,ad populum
"Jane gets a rather large wart on her finger. Based on a story her father told her, she cuts a potato in half, rubs it on the wart and then buries it under the light of a full moon. Over the next month her wart shrinks and eventually vanishes. Jane writes her father to tell him how right he was about the cure.",false causality
Caroline says that she thinks her friends should not be so rude to the new girl. Jenna says that she cannot believe that Caroline is choosing to be better friends with the new girl than the girls who have always known her.,fallacy of extension
President Petutti ordered a military strike that killed many civilians. He is no different than any other mass murder and he belongs in prison!,faulty generalization
"But you have to let me go to the party! If I don't go to the party, I'll be a loser with no friends. Next thing you know, I'll end up alone and jobless, living in your basement when I'm 30!",faulty generalization
The Geo Metro is a superior car because it averages 43 miles per gallon.,intentional
Have you stopped beating your wife?,intentional
"Hydrogen is not wet.  Oxygen is not wet.  Therefore, water (H2O) is not wet.Example #3: Your brain is made of molecules.  Molecules are not the source of consciousness.  Therefore, your brain cannot be the source of consciousness.",faulty generalization
Circular reasoning occurs when someone makes an argument in which both the premises and the conclusion have to rely on the truthfulness of the other.,circular reasoning
"Biology teacher: The theory of evolution states that all species evolve, even humans. Student: I can't accept that humans came from bugs.",fallacy of extension
Have you stopped cheating on tests?  To answer yes means you cheated before. To answer no means you continue to cheat.,intentional
The candidate for mayor was a really bad baseball player in college! Don't vote for him!,ad hominem
"Earthquakes are caused when the plates of the Earth's crust move. Earthquakes happen along ""fault lines"" in the earth’s crust. When the plates in the Earth suddenly shift, the Earth will begin to shift, shake or tremble.",false causality
"""You can't believe that theory. No one would believe that. It's too unbelievable.""",fallacy of relevance
", tax relief instead of tax cut, or death tax instead of estate tax)",appeal to emotion
"all kids love Cinnamon Toast Crunch, but you don't love it so you must not be a real kid",intentional
Nobody thinks homelessness is a good thing.,faulty generalization
"Since event Y followed event X, event Y must have been caused by event X",false causality
"IBM is a reputable organization, so all of its employees must be reputable.",faulty generalization
Why doesn't Tim get a real job like normal people instead of trying to launch that Internet business from home?,fallacy of credibility
Mabel wants to get rid of the student newspaper. Next she will probably want to ban free speech! She won't want us to speak at all! She will make it a law that you cannot speak in public.,fallacy of extension
"""My roommate said her Debate class was hard, and the one that I'm in right now is hard, too. All Debate classes must be hard!”",faulty generalization
"""There I was in the midst of thousands, and yet a perfect stranger; without home and without friends, in the midst of thousands of my own brethren—children of a common Father, and yet I dared not to unfold to any one of them my sad condition."" Check each literary term found in this quote:",appeal to emotion
"JOHN F. KENNEDY: I'm not satisfied when the United States had last year the lowest rate of economic growth of any major industrialized society in the world… (from opening statement) RICHARD NIXON: We heard tonight, for example, the statement made that our growth in national product last year was the lowest of any industrial nation in the world. Now last year, of course, was 1958. That happened to be a recession year. But when we look at the growth of G.N.P. this year, a year of recovery, we find that it's six and nine-tenths per cent and one of the highest in the world today… (from opening statement) September 26, 1960 Chicago, Illinois",faulty generalization
Trying to convince others that everyone is doing it or everyone feels this way so they should too.,ad populum
"Billy - ""Spanish is easy."" Bobby - ""Don't listen to Billy; he failed Spanish class last year. """,ad hominem
"""Stephen Hawking in the smartest scientist on the planet, so if he says global warming is real, it must be true!""",fallacy of credibility
"""He's the best teacher I've ever had because he's the best teacher I've known.""",circular reasoning
You want me to clean my locker? I think I left my homework in Science class. I need to keep up with my homework to get good grades.,fallacy of relevance
"Argues that ""we've always done it that way."" In other words, because something worked in the past, it is the correct thing to do.",fallacy of credibility
"""I want my daughter to go to a state university so she can avoid too much debt."" ""Why do you think state schools are better than private schools? Harvard and Princeton are private."" What is this?",fallacy of extension
Either we have the full football season or we scrap it altogether and have zero football,false dilemma
Your either for America or against her!!!,false dilemma
"My professor, who has a Ph.D. in Astronomy, once told me that ghosts are real. Therefore, ghosts are real.",fallacy of credibility
"My political candidate gives 10% of his income to the needy, goes to church every Sunday, and volunteers one day a week at a homeless shelter.  Therefore, he is honest and morally straight.",intentional
Never be kind and generous to the poor. They’ll come to expect your help always and never learn to contribute to society.,faulty generalization
"In government, arguing for raising taxes - ""We need more revenue to support the programs that we have. Children are our future. Let's support children.""",fallacy of relevance
"Luke didn't want to eat his sheep's brains with chopped liver and brussel sprouts, but his father told him to think about the poor, starving children in a third world country who weren't fortunate enough to have any food at all.",appeal to emotion
"Ross Geller, an evolutionary biologist and perhaps the foremost expert in the field, says that evolution is true. Therefore, it's true.",fallacy of credibility
Deliberately using a fake issue or argument against someone because it’s easier to prove wrong than the real issue would be,fallacy of extension
"Makes people feel as though everyone is doing it, so they should too.",ad populum
"You should never gamble! Once you start gambling you find it hard to stop. Soon you will spend all your money on gambling, and eventually you will turn to crime just to support your gambling addiction.",faulty generalization
"4 out of 5 dentists recommend this toothpaste! (only 5 were asked. Out of 1000 asked, only 20% recommend it)",intentional
"A Congressman calls a Whitehouse Spokesperson a ""giant idiot""",ad hominem
"Ladies and gentlemen of the jury, look at the bloody clothes, the murder weapon. Imagine the helpless screams of the victim. Such a crime deserves no verdict except guilty, guilty!",fallacy of relevance
"At a recent cocktail party, the conversation has turned to family pets, and your friend asks you “Are you a cat or a dog person?""",false dilemma
"Billy: How could the universe be 6000 years old when we know the speed of light, the distance of astronomical objects (13+ billion light years away), and the fact that the light has reached us[1]? Marty: 6000 years is not a firm number.  The universe can be as old as about 10,000 years. Billy: How do you figure that?...",fallacy of relevance
"Christina's shoes are superior, because they're made from one hundred percent snakeskin, not synthetic materials.",fallacy of credibility
"Dr. X is an engineer, and he doesn’t believe in global warming.",fallacy of credibility
Either you love me or you hate me.,false dilemma
A commercial shows a group of friends all hanging out wearing clothes from a popular clothing company.,ad populum
"I go to my front porch every morning and yell, “May no tigers enter this house!” and for 20 years, not a single tiger has entered my house. My tiger prevention strategy clearly works.",false causality
"All boys are sports fans. Some bakers are boys. Therefore, some bakers are not sports fans.",fallacy of logic
You should run right out and purchase the newest iPhone 22 because you will literally be the only one who doesn't own one!,ad populum
"I am voting for Pepitone for President because the rest of my family is voting for her, and I don't want to be the only one not doing so.",ad populum
"I'm raising money to help cure XYZ disease. If you do not donate, you are part of the problem.",false dilemma
Everyone is doing the Low-Carb Diet.,ad populum
Of course Lou would want to go biking on field trip day - biking is the only thing he ever does! He shouldn't be allowed to choose an activity.,ad hominem
Xavier does not deserve to win. He is a smoker and He cheated on his reading quizzes last year.,ad hominem
"No donkeys are fish. Some asses are donkeys. Therefore, some asses are fish.",fallacy of logic
Cassie has no school spirit—she never comes to any of our football games. guilt by association: a negative association intended to discredit someone or something,false dilemma
Invoke shared values and principles. They call upon the audience’s sense of right and wrong.,fallacy of credibility
Everyone else is doing it!,ad populum
No one in your family surfs? But I thought you said you lived in California before this.,faulty generalization
"I asked my five closest friends and they all agree that the new Underwater Basketweaving Team Coach is a jerk, therefore I'm not trying out for the team",faulty generalization
"“It’s wrong to tax corporations—think of all the money they give to charity, and think of the costs they already pay to run their businesses!”",appeal to emotion
"Lily says the sun is fully risen at 5:00am, but how would she know she sleeps in until noon. (love you lily all jokes all jokes)",ad hominem
"Look Tom, you could go to the police with your information about our questionable accounting practices here at Bentron. But remember, you have a family to feed. Besides you know how rumors of this kind of disloyalty can spread through the industry. You'll ever work as an accountant in this town again.",appeal to emotion
"If voluntary euthanasia were to be legalized it would prove impossible to avoid the legislation, or, at least, toleration, of non-voluntary euthanasia. Even if the former can be justified, the latter clearly cannot. Hence, it is better that the first step (legalizing voluntary euthanasia) not be taken so as to prevent a slide into non-volunteer euthanasia.",faulty generalization
"The anti-terrorist laws that monitor international currency transfers, phone calls, and emails are the first step to turning our fragile democracy into a new Nazi regime.",faulty generalization
MacDougal roots for a British football team. Clearly he's unfit to be a police chief in Ireland.,ad hominem
"Yesterday, you were late for ten minutes. Today you were late for an hour. You know someday, you will simply cease to show up.",faulty generalization
something that kills is deadly,circular reasoning
"Mayor: During my previous term as mayor my staff and I spent a great deal of time focusing on our city’s economy, and unemployment reached an all-time high as a result. So clearly you should support my re-election campaign if you are among those still looking for a job.",fallacy of logic
People like to walk on the beach. Beaches have sand. We should put sand on the floor in our living room.,fallacy of logic
"Person 1: You’re either for the war or against the troops. Person 2: Actually, I do not want our troops sent into a dangerous war.",false dilemma
"According to my brain, my brain is reliable.",circular reasoning
Fast food is bad for you because is junk.,circular reasoning
"If we don’t bail out the big automakers, the US economy will collapse.  Therefore, we need to bail out the automakers.",appeal to emotion
Children should not listen to rap music. Everyone knows that.,ad populum
"President Jones raised taxes, and then the rate of violent crime went up. Jones is responsible for the rise in crime.",false causality
The Democrats support more aggressive gun control laws. Can you believe they want to deny repeat offenders and those on the terrorist watch list their rights?,ad hominem
A smoke screen to cover the truth; a clue that is misleading or distracting.,fallacy of relevance
"""Either you recycle or you don't care about human life.""",false dilemma
"Lisa was brainwashed as a child into thinking that people are generally good.  Therefore, people are not generally good.",ad hominem
"I don't believe in God. One reason is that I think he is evil. And by the way, there is no such thing as ""evil;"" it is just our evaluation of what we believe is wrong.",fallacy of logic
"Speaker 1: We are using thousands of people, who are going door to door to help us spread the word about social injustice and the need for change. Speaker: Well then, I can’t be a part of this because I was always been taught that it’s wrong to use people.",equivocation
God must exist because every culture has some sort of belief in a higher being.,ad populum
"After Jhon said that we should put more money into health and education, Warren responded by saying that he was surprised that Jhon hates our country so much that he wants to leave it defenseless by cutting military spending.",fallacy of extension
You know Jane Fonda's exercise videos must be worth the money. Look at the great shape she's in.,false causality
I've never been hit by lightening when standing under a tree so we'll be perfectly safe to shelter by this oak now.,intentional
"Senator A: ""We should spend less on our military budget and spend more on health and education."" Senator B: ""So you want to leave the country defenseless?""",fallacy of extension
"If I don't take the right classes in high school, then I won't be able to get into a good college. If I don't get into a good college, then I won't be able to get a job. If I can't get a job, then I am going to end up homeless.",faulty generalization
"If you drive without car insurance, then you’re an accident waiting to happen. Stay protected with Auto Union insurance.",false dilemma
Valencia bought a different brand of detergent at the store. She developed a rash after wearing clothes washed in the new detergent. She concluded that she was allergic to the new soap.,false causality
SM 5: Argument regarding insanity as a defense against execution,fallacy of relevance
"Every time I go to sleep, the sun goes down. Therefore, my sleeping causes the sun to set.",false causality
", if everyone else is doing something, it must be right/good.",ad populum
"He has plundered our seas, ravaged our coasts, burned our towns, and destroyed the lives of our people",appeal to emotion
"company's slogan ""Eat Fresh.""",appeal to emotion
Jack: You should stop smoking - it's bad for you. Jill: Look who's talking! You smoke three packs a day!,ad hominem
"Brad's mother asked him why he wasn't trying out for the school play. He responded: ''Because if Tom gets the male lead, which he always does, then I'll only be in the chorus, and it's not worth being in the play if I'm only going to be in the chorus.''",faulty generalization
"There are no good restaurants in New York; I tried two in Times Square, and they were awful.",faulty generalization
Global warming doesn’t exist because the earth is not getting warmer,circular reasoning
Richardson is the most successful mayor the town has ever had because he's the best mayor of our history.,circular reasoning
"""We've got to stop them from banning poetry. Once they start banning one form of literature, they will never stop. Next thing you know, they will be burning all the books!"" Ammar demanded.",faulty generalization
You can either start using plastic straws or continue killing ocean life with plastic pollution.,false dilemma
"Since the class is not asking any further questions, then that means that they are all ready for the test.",intentional
You can be a good politician and play dirty or you can drop out.,false dilemma
"There were wonderful psychologists who passed away several decades ago. If they could be effective in what they did without reading any of the studies or other articles that have been published in the last several decades, there's no need for me to read any of those works in order to be effective.",fallacy of logic
"If we use just one more can of hairspray this month, earth as we know it will no longer exist.",faulty generalization
Millions of people drink Diet Coke every year so it must be the best soft drink in the world.,ad populum
gun registration would start us sliding into the unconstitutional morass of universal arms confiscation.,faulty generalization
"Medical Student: ""No one objects to a physician looking up a difficult case in medical books. Why, then, shouldn't students taking a difficult examination be permitted to use their textbooks?""",fallacy of logic
"Recognising that Amanda had committed a fallacy in arguing that we should eat healthy food because a nutritionist said it was popular, Alyse said we should therefore eat bacon double cheeseburgers every day.",fallacy of logic
"""All my friends are doing a low carb diet. That must be the only way to lose weight."" Mentioned Murtaza",ad populum
"""I started exercising twice a week, and I just got a babysitting job. Exercising leads to new jobs!""",false causality
"Major in English in college, start reading poetry, and next thing you know, you will become an unemployed pot-smoking loser.",faulty generalization
Naima is scratched by a cat while visiting her friend. Two days later she comes down with a fever. Naima concludes that the cat's scratch must be the cause of her illness.,false causality
We have a responsibility to care for this poor lost dog.,appeal to emotion
"A mother is telling her daughter that she went over her data for the month, and the daughter begins telling her mother about getting an A on a math test.",fallacy of relevance
Why must you always take positions that are so unscientific?,circular reasoning
Appeals to an authority that has little to nothing to do with the argument,fallacy of credibility
I met a rude person from France yesterday. I guess all French people are rude.,faulty generalization
"Mr. Governor issues a proclamation for the people of his state to pray for rain.  Several months later, it rains.  Praise the gods!",false causality
Misrepresents the context from which a quotation is taken; putting words or ideas in people’s mouth/head; creating a “dummy” or fake or falsified argument or situation so you can attack it.,fallacy of extension
"Cari says that we need a major overhaul in education. Cari gets a speeding ticket every other week, so maybe she should learn how to drive instead of worrying about schools.",ad hominem
Democrats are gay and Republicans are rich.,faulty generalization
"Every time I was my car, it rains. Me washing my car has a definite effect on the weather.",false causality
It has a picture which might make people feel sad.,appeal to emotion
The speaker/author chooses a deliberately (on purpose) bad or oversimplified example in order to ridicule (make fun of) or refute (prove wrong) an idea,fallacy of extension
EP is poppin'! Everyone worth knowing is here tonight - come on down!,ad populum
Pay taxes or go to jail,false dilemma
"You should always eat everything on your plate, think of all the children in Africa who doesn’t always have enough food.",appeal to emotion
"My new method of conducting meta-analyses is the most valid there is because it is the only one capable of such validity, the only one that has ever approached such validity, and the only one that is so completely valid.",circular reasoning
"We must have a poltergeist in the house. When the dog ran under the table, the vase just seemed to jump off the shelf all by itself.",fallacy of logic
"Some students failed a test last week and they all had cell phones.  Having cell phones, therefore, made them fail.",false causality
"""I used to have that haircut. Then my mom got a job.""",ad hominem
"Sometimes flu vaccines don’t work, therefore vaccines are useless.",faulty generalization
"The noble forefathers who created this great country did not fail; it is a great country now as it was then, by their very making.",ad hominem
"David: Can you believe that the president said, ""fat people are losers""? Sam: Where did you hear this? David: I read it in a headline on BrightBert News. Sam: He actually said, ""People who say, 'fat people are losers' are not only cruel, but they are also wrong as well as being irrational.""",intentional
"Even though it's only the first day, I can tell this is going to be a boring course.",faulty generalization
"My father smoked four packs of cigarettes a day since age fourteen and lived until age sixty-nine. Therefore, smoking really can’t be that bad for you.",faulty generalization
1. All the schools in the area had to kept closed for most part of the week. 2. Many parents have withdrawn their children from the local schools.,false causality
All dogs go to heaven.,faulty generalization
“You should always do what you are being told because following the rules is important.”,circular reasoning
"Advocates for a tight virus response say ""we need to limit the spread."" What they're really saying is we need to shut down everything forever, leading to massive economic damage.",fallacy of extension
I saw that dog eat chicken so all dogs must only eat chicken.,faulty generalization
People who read are smart.,faulty generalization
All women care about are their looks.,faulty generalization
Everyone is buying the new iPhone that’s coming out this weekend. You have to buy it too,ad populum
She should not be voted president because she's a liar and a thief.,ad hominem
"Sure, that charity group is under investigation for misusing funds, but everyone deserves a healthy meal.",fallacy of relevance
"All judges are fair-minded individuals;  therefore, Judge Ito is fair in his decisions.",fallacy of logic
It is the center of the spectrum of two extremes of deficiency and excessiveness.,fallacy of relevance
Science shows us that improved quality of life comes through research and invention.,equivocation
"Trying to finish a marathon is impossible, I know because I tried it once.",faulty generalization
employs analogies between things that are not really alike,fallacy of logic
"A dog would be a great addition to our family. Think about how wonderful it would be to come home to a happy, excited, loving dog?",appeal to emotion
