text,label
"P1. Smoking has been empirically proven to cause lung cancer. C. Therefore, if we eradicate smoking, we will eradicate lung cancer.",false causality
Ashley: It is morally wrong to cheat on your spouse; why on earth would you have done that. Hannah: But what is morality exactly? Ashley: It’s a code of conduct shared by cultures. Hannah: But who creates this code?...,fallacy of relevance
We either ban hairspray or the world will end.,false dilemma
"Sugar is an essential component of the body...a key material in all sorts of metabolic processes,' neglecting the fact that it is glucose (blood sugar) not ordinary table sugar (sucrose) that is the vital nourishment.",equivocation
My uncle eats pizza and cake and he is thin. Pizza and cake aren’t the cause of obesity.,faulty generalization
"If there is no freewill, then we are not ultimately in control of our actions. If this is true, our entire system of justice would be seriously flawed. This would be very bad; therefore, freewill must exist.",appeal to emotion
"""You can never give anyone a break. If you do, they'll walk all over you.""",faulty generalization
"While jogging around the neighborhood, you are more likely to get bitten by someone’s pet dog, than by any member of the canine species.",faulty generalization
"If the government allows psychologists to prescribe medications there will be no basis to block them from obtaining competence and legal authority to conduct other traditionally medical procedures such as diagnosing minor skin irritations, treating a sprained ankle, setting a broken bone, and performing neurosurgery."" Or: ""Never reduce a fee for any patient for any reason or else you'll find yourself constantly reducing fees for everyone, everyone will take advantage of you, your patients will lose respect for you and for therapy, and you'll loose money and go bankrupt.",faulty generalization
"If you eat that cookie tonight, you'll eat ten tomorrow, and by this time next year, you'll be eating 1 million cookies a day.",faulty generalization
"Idea X is popular. Therefore, X is correct.",ad populum
"When an advertiser tries to make a connection with the audience emotionally through sappy stories, music, sad puppies, etc...",appeal to emotion
There aren't enough parking spaces on campus because there are too many cars.,circular reasoning
"We have to stop the tuition increase! The next thing you know, they'll be charging $40,000 a semester!",faulty generalization
"""Andrea Dworkin has written several books arguing that the media harms women when it comes to body image. But Dworkin is an ugly, bitter person, so you shouldn't listen to her.""",ad hominem
Tommy went to go swimming for the afternoon and later bought a lottery ticket. He won the lottery which must mean that swimming makes you win the lottery.,false causality
"If we legalize pot, the next thing you know people will want to legalize meth and heroin.",faulty generalization
Filthy and polluting coal should be banned.,circular reasoning
"If we put limits on the right to bear arms, soon all of our Constitutionally-given  rights will be taken away.",faulty generalization
Recent auto accidents in your neighborhood have led you to propose to the city council that the speed limit along Main Street be reduced to calm the traffic flow. Opponents complain that reducing speed limits all over town is counterproductive and an unnecessary burden on drivers.,fallacy of extension
"Sukaina to her mom: Either you buy me this new book, or you decide that reading is not important at all.",false dilemma
President Kennedy said that research for space travel could help children with eye defects,appeal to emotion
"  Homosexuality is / ought to be morally wrong (moral property) because it is not normal (natural property). or Homosexuality is not normal (natural property); therefore, it is / ought to be morally wrong (moral property).",fallacy of credibility
"“If we allow gay people to get married, then the next thing you know people will be wanting to marry their pets!”",faulty generalization
They are dangerous militants out to destroy our peaceful way of life.,appeal to emotion
"Company R.E. are working on advertisement for a new juice drink. Some of their marketing employees went to a school to do a survey on students’ beverage preference. The majority said they preferred orange-flavored drinks, so Jeff told his superiors that orange was the flavor favored most by high school students.",ad populum
"company's slogan ""Expect More. Pay Less.""",appeal to emotion
Of course that doctor advocates vaccination—he probably owns stock in a pharmaceutical company.,ad hominem
"I think that we should reject what Father Jones has to say about the ethical issues of abortion because he is a Catholic priest. After all, Father Jones is required to hold such views",ad hominem
Senator Smith says we should cut back the Defense budget. His position is that we should let down our defenses and just trust our enemies not to attack us!,fallacy of extension
"The new vice president has never gone to public school, so he can never connect to the middle and lower class.",ad hominem
Get Verizon--1 billion people can't be wrong.,ad populum
"""Andrea Starkk has written several books arguing that the media harms women when it comes to body image. But Starkk is an ugly, bitter person, so you shouldn't listen to her.""",ad hominem
"""Because I forgot to leave my porch light on, someone robbed my house.""",false causality
Do you support freedom and the right to bear arms ?,intentional
Canada is the best country to live in because it's better than the other countries!,circular reasoning
Did John ever give up his bad habits?,intentional
America has to act now to reduce illegal immigration. Recent studies show that the vast majority of Americans think that illegal immigration is a problem.,ad populum
Person 1: If you are a Marvel fan then you love Avengers: Endgame. Person 2: I am a Marvel fan and I did not love Avengers: Endgame. Person 1: Well you aren’t a TRUE Marvel fan.”,intentional
"No one has ever been able to prove that extraterrestrials do not exist, so they must be real.",intentional
Don't listen to her advice about math. She doesn't even know how to tie her own shoes!,ad hominem
"""It is what it is!""",circular reasoning
“Honesty is defined as always being honest.”,circular reasoning
"If everyone believes it, you should too!",ad populum
"I hear the rain falling outside my window; therefore, the sun is not shining.",fallacy of logic
You either are for us or you are all against,false dilemma
Why should we worry about the negative depiction of women in music videos when thousands of women are dying of AIDS each year?,fallacy of logic
"Person A: ""What's the weather like?"" Person B: ""It's 2:00""",fallacy of logic
"Lots of people bought this album, so it must be good.",ad populum
A commercial claims that a specific brand of cereal is the best way to start the day because athlete Michael Jordan says that it is what he eats every day for breakfast.,fallacy of credibility
"The book Investing for Dummies really helped me understand my finances better. The book Chess for Dummies was written by the same author, was published by the same press, and costs about the same amount, so it would probably help me understand my finances as well.",fallacy of logic
"""Truly helps cramming for a test: my psychological test is crowded and I have an A.""",false causality
Al Gore feels that all companies are irresponsible and should be punished for allowing emissions which causes global warming.,fallacy of extension
"Your mom gets your phone bill, and you have gone over the limit. You begin talking to her about how hard your math class is and how well you did on a test today.",fallacy of relevance
"Red had come up six times in a row on the roulette wheel, so Greg knew that it was close to certain that black would be next up. Suffering an economic form of natural selection with this thinking, he soon lost all of his savings.",ad populum
"I know the professor said the Bridges of Madison County was smarmy trash and lacked any artistic worth. But I still think he's wrong. After all, it was on the best-seller list for over 100 weeks.",ad populum
Don’t believe what Alex says about global warming. Alex dropped out of college!,ad hominem
"Daughter: Mom, I want that doll! Mom: Let's get home and I'll get you a popsicle! Daughter: Ooh, popsicle!",fallacy of relevance
I don't understand why you're saying I broke a promise. I said I'd never speak to my ex-girlfriend again. And I didn't. I just sent her some pictures and text messages.,equivocation
"""America: Love it or leave it""",false dilemma
"Dad drank at parties, too",ad hominem
"After years of ignoring God, people have a hard time realizing what is right and what is wrong, what is good and what is bad.",circular reasoning
I didn’t steal your pen—I borrowed it,equivocation
", when in fact more possibilities exist.",false dilemma
"Almost everyone that was asked said that McDonalds is better than Burger King, so it must be true",ad populum
"On my walk to work this morning, a woman on her bike nearly ran me off the sidewalk. I hadn't realized that cyclists were so aggressive and rude!",faulty generalization
You say that Coach Smith pressured teachers to give his students passing grades. But don’t you agree that athletics are important to schools? Don’t they build character?,fallacy of relevance
I have been accused of using an ad hominem approach in trying to defend my research. But those who attack me and my research are also using ad hominem. And they started it!,ad hominem
"""I don't know how to complete my geometry homework tonight; I probably can't pass the course since I can't do this one assignment.""",faulty generalization
If we ban cell phones because they are bad for teenagers next the government will ban all iPods and eventually all video games as well.,faulty generalization
"I think scientists are wrong. There is no such thing as global warming. I just finished talking to my boss, and he thought the idea was ridiculous.",fallacy of credibility
"Boris is not qualified to make suggestions about our penal system. As an ex-convict, he would always take the criminals’ side.",ad hominem
"If I say that a surgeon should be allowed to use a guidebook to carry out surgery like a student can use open notes on a test, I have made a",fallacy of logic
"Boy , those sound like pretty terrible, epicly fascist (hint) robots.",fallacy of relevance
"Now that the Chiefs are going to the Super Bowl, everybody is suddenly a fan.",ad populum
"If Mom didn't turn off the air conditioner, then clearly she must be too hot.",false dilemma
The Tooth Fairy is real because nobody has proven she doesn't exist.,intentional
"Your honor, while my son may have made a bad decision that night while under the influence of alcohol, it shouldn't affect the rest of his life. It was just one mistake. He's on the varsity swim team.",intentional
Mrs. Sedik really knows math; she would be an excellent math instructor.,fallacy of logic
Habib didn't remember to take out the trash this morning. It will pile up and the neighbors will complain and the health inspectors will come and take away the kids.,faulty generalization
"The Senator thinks we can solve all our ecological problems by driving a Prius. Quite the contrary, the Senator thinks the environment is such a wreck that no one’s car choice or driving habits would make the slightest difference",fallacy of extension
"The reason everyone wants the new ""Slap Me Silly Elmo"" doll is because this is the hottest toy of the season!",circular reasoning
My teacher always brings up stuff about Women's Rights. She only cares about it because she is a woman. The stats she shows us are probably bias.,ad hominem
I cannot listen to anyone who does not share my social and political values.,ad hominem
"""Every time I go to sleep the sun goes down. Therefore, my sleeping causes the sun to set.""",false causality
Vote for me or live through four more years of higher taxes.,false dilemma
People who have to have a cup of coffee every morning before they can function have no less a problem than alcoholics who have to have their alcohol each day to sustain them.,fallacy of logic
"All the popular guys at school are dyeing their hair purple, so you should, too!",ad populum
Why would you trust Paris Hilton to sell health food? She drinks and parties and has multiple partners.,ad hominem
"math makes no sense, it can’t be real so I must not need this.",intentional
My child was diagnosed with autism after receiving vaccinations. That is proof that vaccines are to blame.,false causality
"""The art teacher spoke in the trial as a witness in support of testing perfumes on animals, and he persuaded me.""",fallacy of credibility
"President Bennett is an effective communicator, because he has a natural talent for speaking with people.",circular reasoning
We are not weak if we make a proper use of those means which the God of nature hath placed in our power.,fallacy of credibility
Forty million people won't be wrong. Please buy the latest iPhone 12.,ad populum
"She has always associated with shady people, so she must not be trustworthy.",faulty generalization
"Power lines cause cancer.  I met a little boy with cancer who lived just 20 miles from a power line who looked into my eyes and said, in his weak voice, “Please do whatever you can so that other kids won’t have to go through what I am going through.”",appeal to emotion
"I should receive an 'A' in this class. After all, if I don't get an 'A' I won't get the fellowship that I want.",appeal to emotion
"Jojo: All New Yorkers are tough. Charli: I get shoved in a locker every day and cry when I see bunnies. Jojo: Well, REAL New Yorkers are tough. Charli: What does toughness have to do with Geography?",intentional
"If you don’t eat breakfast, you’ll slouch in your desk. If you slouch in your desk, you’ll hurt your back. If you hurt your back, you’ll never become President.",faulty generalization
"Billy - ""An apple is a vegetable.""  Bobby - ""Don't listen to Billy; he failed Spanish class last year. """,ad hominem
Either you eat this meatloaf or you eat nothing.,false dilemma
Speaker 1: No fault divorce has proven to be detrimental to society and the family. Speaker 2: You didn’t seem to think that when you got divorced.,ad hominem
"We live in paradise, but we don't know it.",fallacy of logic
"Matthew: Everyone believes that teachers get paid enough for the job they do. Therefore, it must be true.",ad populum
Trying the latest social media challenge is a good trend,ad populum
Of course Marx' theories about the ideal society are bunk. The guy spent all his time in the library.,ad hominem
Eat lamb--could thousands of coyotes be wrong?,ad populum
There was a fight at school today. Violence is a growing problem in school.,faulty generalization
Within every man's heart is the desire to be free.,faulty generalization
"Some of you have objected to the new test batteries that were purchased for our program, alleging that they have no demonstrable validity, were not adequately normed for the kind of clients we see, and are unusable for clients who are physically disabled. What you have conveniently failed to mention, however, is that they cost less than a third of the price for the other tests we had been using, are much easier to learn, and can be administered and scored in less than half the time of the tests we used to use.",fallacy of relevance
"I hope the art mural at 34th and Habersham will not be allowed. You open the gate for one, you open it for all and you'll have it all over the city. A person wanting to paint on buildings is nothing more than upscale graffiti. More than likely it will go too far.",faulty generalization
"A warm beer is better than a cold beer. After all, nothing is better than a cold beer, and a warm beer is better than nothing.",equivocation
"Al Gore's support of the discussion of sexual orientation issues on Ellen is  dangerous:  he advocates the exposure of children to sexually explicit materials,  which is wrong.",fallacy of extension
"""We will teach this miserable traitor(Snowball) that he cannot undo our work so easily.""",ad hominem
The milk was left out all night and was spoiled. It should have been put in the refrigerator,false causality
"An advertisement asking people to give to St. Jude Research Center to help children struggling with cancer. You wouldn't want to let these children die, right?",appeal to emotion
"I'm not a doctor, but I play one on the hit series, ""Bimbos and Studmuffins in the OR."" You can take it from me that when you need a safe and effective pain killer, there is nothing better then MorphiPill 2000. That is my professional medical opinion.",fallacy of credibility
Flippityflu: smarter than a Floppityflip. Floppityflip: dumber than a Flippityflu.,circular reasoning
Nike's are great because they're awesome.,circular reasoning
"You say that we have exaggerated the problem with global warming, but have you even considered how much more the homeless suffer when temperatures soar?",fallacy of relevance
" Tony: I bought a book on the law of attraction and two days later I won $30k in a lottery. I wasn’t a believer of the law of attraction before, but now I am!",false causality
"If I tell my teacher I have done my homework, but I have only done part of it, I am using",equivocation
Portraying one's opponent's position in a simplified manner so that it is easy to argue against.,fallacy of extension
"This tactic plays upon a viewer's lack of knowledge by forcing the idea that the situation is static. Unless the audience is well-informed and aware of this deception, they may think that they have only two choices.",false dilemma
"Superstition is a belief or practice resulting from ignorance, fear of the unknown, trust in magic or chance, or a false conception of causation -- unless it is astrology.",intentional
John: Members of the UbaTuba White Men's Club are upstanding citizens of the community. Marvin: Then why are there so many of these members in jail? John: They were never true UbaTuba White Men's Club members. Marvin: What’s a true UbaTuba White Men's Club member? John: Those who don't go to jail.,intentional
"Since a single human cell becomes a grown man over a period of a few years, then surely it can't be impossible for a single-cell organism to become the human race over a period of several million years.",fallacy of logic
I failed my AP vocab test so clearly I'm going to fail the class. Then I won't get into college and will never get a job. I will have to live in my parents' basement for the rest of my life. My life is ruined,faulty generalization
"I like my steak rare. But I don’t care for aardvark steak, even though it’s the rarest steak in the world.",equivocation
My opponent is trying to convince you that we evolved from monkeys who were swinging from trees; a truly ludicrous claim.,fallacy of extension
"All of my friends are coming to my birthday party. If Micah doesn't, she might as well tell me that she doesn't like me.",false dilemma
"If you don't buy the black pencils, you will get made fun of. You will not be chosen for group projects.",appeal to emotion
"arguing at length that your religion is of great help to many people. Then, concluding that the teachings of your religion are undoubtably true",fallacy of logic
All four year olds talk too much.,faulty generalization
"“Feminists want to ban all pornography and punish everyone who looks at it! But such harsh measures are surely inappropriate, so the feminists are wrong: porn and its fans should be left in peace.”",fallacy of extension
"Un pleasant idea of vegan diet. There is strong movement from people who choose not to consume meat, and their reasons vary from the healthiness to the effort of making the body looks appropriate or ideal. This is a rather ludicrous idea. Human beings have been consuming meat since thousands of years and counting. There are no cases when consuming meat causing severe problems, provided meat is consumed in appropriate amount, for everyone. Many say that being a vegan means having a healthier, stronger body and mind. Actualy, according to studies, our bodies are perfectly capable of digesting, absorbing and making full use of the many beneficial nutrients found in animal foods. Thus, there is no health reason to completely avoid animal foods. Don’t put unnecessary restrain on yourselves. You should enjoy life to the fullest; give your best in any possible situations, as well as consuming meat.",false causality
I can tell this movie is going to be terrible; the opening credits aren't even over yet!,faulty generalization
"If you don’t expose your child to germs, he will never get sick. Therefore, he will never build up his immune system to fight illness. He will grow up to be a sickly adult.",faulty generalization
"You cannot blame your friends for a rain delay just because every time they go with you to a ballgame it storms and play is delayed. Likewise, the fact that a pitcher bought new socks before he pitched a winning game does not mean that new socks cause a pitcher to throw faster.",false causality
"Speaker 1: I think we should have an expanded social safety net for the poor in our country. Speaker 2: So, you think we should just throw money at lazy people who don’t want to work and think they are entitled to be kept up by other people, right?",fallacy of extension
We think that Malltime will be a success because all little girls like shopping.,faulty generalization
The writer or speaker intentionally misleads the audience by using a word with a double or ambiguous meaning.,equivocation
"Mining may destroy the environment, but how about the people whose jobs will be affected? Should we ban it?",fallacy of relevance
"Allowing overnight guests in the dorm rooms will lead to nothing but trouble: promiscuity, teen pregnancy, and eventually, a bunch of unwed mothers on campus, trying to complete their degrees while raising a child.",faulty generalization
We shouldn't let teenagers keep their phones just because they're upset at losing them; most babies cry when you take their toys away too.,fallacy of logic
Eighty-five percent of those surveyed said that it is important to have a cell phone.,false causality
"If I eat this donut today, I'll probably do it again tomorrow and the next day, and then I'll never be able to eat healthy again.",faulty generalization
"If you had school pride like the rest of us do, you would wear a mountain lion costume every day.",ad populum
Won't you give the abandoned puppy a home?,appeal to emotion
"Mormonism is one of the fastest growing sects of Christianity today so that whole story about Joseph Smith getting the golden plates that, unfortunately, disappeared back into heaven, must be true!",ad populum
"The presence of police at protests cause an escalation of violence. It was the case that at the protest last night attended by uniformed police, there was an escalation of violence. Therefore, police should not be at protests.",false causality
All people who live in England have bad teeth.,faulty generalization
"According to the university brochure, the majors with the most students are Economics and Computer Science. Therefore, you should declare one of these majors if you want to have a successful career.",ad populum
"Everyone loves Rebecca, because she is so popular.",faulty generalization
Because doctors smoke it must be a healthy choice.,fallacy of credibility
Believing that taco bell is healthy for you because everyone else does.,ad populum
“How can you argue your case for vegetarianism when you are enjoying your steak?”,ad hominem
Witchcraft remains our most urgent spiritual problem because it threatens our very souls.,circular reasoning
"I have served over 20 years in the military, and based on my professional opinion, I believe more money needs to be spent on protective armor and military vehicles.",fallacy of credibility
"Earl: Men don't cry. Jaquon: I cry all the time; it's healthy. Earl: Well, REAL men don't cry. Jaquon: Earl, you should invest in some therapy.",intentional
The is zero doubt that she has the condition. She scored high on two separate diagnostic tests for it and both tests have shown extremely high validity. That proves she has it.,fallacy of relevance
"""Do not listen to Luisa, she will only tell you lies about the recent activities given in our EAPP class.""",ad hominem
"We cannot unlock our child from the closet because if we do, she will want to roam the house.  If we let her roam the house, she will want to roam the neighborhood.  If she roams the neighborhood, she will get picked up by a stranger in a van, who will sell her in a sex slavery ring in some other country.  Therefore, we should keep her locked up in the closet.",faulty generalization
"She is good at writing because she writes words effectively.""",circular reasoning
"Using positive words that become associated with something, like company slogans and political advertisements",appeal to emotion
"My friend swears the mechanic at that shop overcharged her last week and after looking at her invoice it seems she’s right. So don’t take your business there, as you’ll definitely get ripped off.",faulty generalization
"The majority of people believe advertisers should spend more money on billboards, so billboards are objectively the best form of advertisement.",ad populum
We should present Cadet Curry with our squadron’s cadet of the year award. He’s the most active and highest-performing cadet we have. REPLY: But Cadet Arnold has been in CAP longer.,fallacy of relevance
